rating,comment,time,votes
4,初篇动画末真的是够吊人胃口的...不过看如今漫画的进展速度，一年一篇估计是逃不掉了...除了热血打斗血腥重口之外其实内容还是挺多的，希望能做成钢炼那样的作品吧。【千万不要坑太大】,2013/9/29 14:55,0
5,好几个漫友推荐，这两天终于看了，久违的好片啊，什么时候出第二季啊，什么谜团都还没解嘛,2013/10/27 0:34,0
4,作画好得不必多说,2013/4/13 17:51,0
5,不管怎么说 还是很期待二季,2014/2/22 21:23,0
4,燃烧吧，我的愤怒！！,2016/1/31 22:08,5
5,别再黑我大兵长！！！！,2014/1/9 19:42,0
4,"就是打得真特么惨，死人死太快。
不过我的感觉像是烂尾，地下室，变身的秘密还都没揭露啊。偶尔几幅定格动画，也是非常漂亮。",2014/1/1 14:24,0
5,这个设定，再加上泽野弘之大神的配乐，不脑残的对白，给力的节奏，以及那一道道黑线，神作预订，今年最佳预订，气势已经赶上12年的刀剑神域了，全25话在山西秒杀完毕。,2013/11/8 23:49,0
5,很长时间没有看的这么爽快了...,2014/2/5 12:21,1
5,想要打败怪物就只能抛弃人性成为怪物吗？我们拼尽全部，却一无所获，牺牲得毫无意义。好丧的基调，我好喜欢。,2023/11/10 21:29,0
4,越看越气，妈的每集都是老娘等这么久你就给我看这个的心情！,2013/10/5 18:29,0
4,最直观的感受是非常粗暴直接地表现死亡，不是卖弄或把血腥当噱头，而是不回避地宛如日常似的出现死亡场景，因为它在这个故事里回避不了，不需要特意描绘。第一季还大部分尚在常规少年漫的套路之中，但能看出未来走势的诡谲。期待。,2020/7/17 1:57,1
4,女巨人亚妮结晶...期待第二季...,2013/10/27 19:25,0
4,S1E4 越有能力击退巨人的人越逃避去做这件事，不断磨练对抗巨人的技巧是为了远离巨人。E6如此浅显易懂甚至让人倍感亲切的世界。S7我有承担起这一切责任的资格吗S8其实我很清楚啊，现实，我一直在幻想吗S11整个人类都是有罪的。他们有名字有家人，虽然今天必定牺牲但你不能认为他们是棋子！,2013/12/26 14:03,0
5,画面精致 情节出其不意,2013/6/21 20:58,0
4,http://movie.douban.com/doulist/3455175/,2013/11/11 0:03,0
4,兵长两米八~！（拒绝反驳！）而且我还差点喜欢上了女巨人是什么鬼！（果然我内心还是爱慕着一切看起来强大的事物啊！）,2017/7/30 23:48,2
5,总之我觉得好看，尽管不喜欢男主这种性格，，，,2014/2/4 18:45,0
4,很棒的剧本～不拖拉。,2013/11/8 0:27,0
4,亚妮~柔弱少女~哭得好美~三爷威武~,2013/10/14 23:07,0
4,OST&OPED太加分了。以及，论一口气补番的重要性。【真人化神马的去shi吧【兵长脸← ←,2014/1/3 20:29,0
5,好！爱！兵！长！,2013/11/7 23:55,0
5,三爷泥补药喜欢小天屎了，娶我吧w❤❤❤,2013/10/1 21:00,0
4,快出第二季啊 混蛋,2013/10/1 2:11,0
5,配乐真是棒！刚开始的慢节奏把我快逼死了，兵长超帅啦，艾伦怂毙了╮(╯_╰)╭快来下一部吧,2013/11/28 15:26,0
5,最高！最高！最高！兵长！艾伦 Mikasa 阿尔敏 韩吉分队长等等等等。。！！最高！以及 一些冷不丁的梗都好好笑！,2014/3/30 21:09,0
5,可惜故事太小了，讲来讲去就这几个人的事情,2013/9/24 0:54,0
5,好爱三爷~~~~~~~~呜呜呜 看个动漫 集集都看得来眼泪花儿包起 呜呜呜 我的佩特拉！！！！！！！！,2013/10/5 2:51,1
5,重看更喜欢了,2013/8/1 16:33,0
5,好看好看  正在追,2013/9/19 22:20,0
5,这本漫画真厉害！,2013/10/4 15:25,0
5,2013最好看的没有之一,2014/1/6 1:01,1
4,原来是个大坑啊……,2013/10/4 7:05,1
4,三笠赞  不知道哪里来的一堆腐女揪着艾伦和兵长无视青梅竹马 起码兵长也要和团长才差不多好吗 扣一星,2013/11/9 0:38,0
4,太拖,2014/5/3 19:39,0
5,如果动漫界有奥斯卡的话，本片可以像割草一样，斩获所有的奖项。第一季来说，已经奠定了神一样的位置，太好看了。这个动漫不怕剧透……为了不让自己混乱，还是要说一下，本季的完结点是女巨人被打败，全身硬化。,2020/9/30 22:15,0
4,画风和剧情还是比较吻合的，给人热血战斗的感觉。喜欢片中一句台词“能够战胜巨人，即使舍弃人性也在所不惜”，那这样即便战胜了巨人，人类还能被称作是人类吗？,2013/10/6 8:50,0
5,震撼！史诗！配乐，画面美极！这难道不是歌剧一样的美吗？花了三天时间看完，简直就是暴力美学的极致！（不是，我在说什么ー_ー）兵长戏份那么少，每次出场却总是那么美，让人如何不爱啊啊啊啊！,2021/2/6 17:48,0
4,按漫画这速度第二季遥遥无期,2013/9/29 11:13,0
5,只有我一人觉得片头比片尾好听么- -,2013/7/30 22:38,0
4,后十集开始才有佳作的感觉。另外，男主很讨人厌==+,2013/11/1 21:14,0
5,喜欢被圈养的人 安逸的生活如同猪一般……天朝有多少猪？艾伦需要力量 你是否有勇气？ 那一天 人类终于回想起 曾经一度被它们所支配的恐怖 还有被囚禁于鸟笼中的那份屈辱……,2013/10/21 11:19,0
4,速度啊，下一季,2013/9/29 14:07,0
5,深刻的漫画~,2013/9/23 19:57,0
5,不错,2013/9/29 13:07,0
4,开头几集有看头...后面就拖沓了...,2014/3/6 19:09,0
5,满分不解释！总是卡在奇怪的地方！希望有生之年还能看到第二季,2014/1/5 7:36,0
5,燃爆了！！看完整个人都在颤抖！！！坐等第二季！！！！兵长CV一声推！！！三爷真爱不解释！！！,2013/11/6 23:37,0
5,看的时候会有一种似乎是来自远古的恐惧感。,2013/9/17 10:10,0
5,套路的热血中二，暴走激战，角色脸谱，但是脑洞清奇的设定，完整严谨，整季节奏极好，剧情逐步爆发。选择自己还是信同伴，超越怪兽舍弃人性，世界太过残酷，有坑有思考，看到了叙述的野心。,2017/11/21 0:05,2
5,其实还是觉得TV版微毁漫画。。。,2014/6/2 14:17,0
5,一开始就怀疑巨人有智商，100年和平的假象背后，主角爸爸的实验是什么？其实不过还是人和人斗。各方势力角力，可怜年轻人永远都是冲在前面。刚想压抑，逗比留出现了，土豆好吃吗；刚习惯大喊大叫，熟悉的声优冷淡一开口，兵长那咸鱼眼睛居然都觉得迷人。没有谁是高尚的，弱肉强食，适者生存，人性之恶也有人性至善。,2019/6/22 10:10,0
4,呜哇，各种燃。,2013/6/6 14:44,0
5,"21话,第21话!!直接把我燃哭了!!虽然如此但我还是想吐槽,其实这不就是一部热血版的美少女战士吗?",2013/10/1 20:02,0
5,塔塔开！！,2023/9/7 16:07,0
4,进击吧，阿尔米以后当团长的架势。,2014/5/1 22:10,0
5,超燃,2013/10/7 22:14,0
5,期待第2季。。。,2013/10/29 1:30,0
5,燃了！！！！！！！！！！！！！！！！！！！！！,2013/7/12 22:13,0
4,动画节奏上有时。。。但总体好评,2013/10/1 0:34,0
4,个人觉得很一般，竟然被捧这么红。另外腐女们把它也毁的差不多了吧,2013/11/16 23:17,0
5,兵长一米六~,2013/9/30 22:32,0
4,剧情进展太缓慢了，摔！,2013/9/29 22:15,1
5,兵、兵兵兵长！,2013/9/29 17:13,0
5,怎么说呢？我是巨人脑残粉~,2013/7/9 11:34,0
5,第一部吧，刚开始感觉很新鲜，很劲爆，但还是逃脱不了日本传统动漫模式，而且，我觉得继火影和海贼，自己又多了个泥潭。,2013/12/30 9:49,0
4,只看了第一集，还不错。。。,2013/7/2 15:03,0
5,燃！,2014/1/4 1:02,0
5,看完最后一集觉得也蛮好的,2013/9/29 18:11,0
5,20130929看完 总是有令人激动热血的时候！！三笠好帅！！死了好多人TAT,2013/9/30 12:47,0
5,霸权动画，漫画的不好，都被动画补完了，本就是文本视觉设定都足够好的一部。,2020/12/8 23:08,0
5,动画化的非常到位~能分级就更棒了...期待第二季,2013/10/6 21:37,0
4,除了中段拖沓 别的都不错 音乐尤其出色,2013/9/29 22:38,1
4,貌似很火的样子就去看了，题材确实不错，可惜只有出了六话，待追。喜欢马铃薯女。,2014/2/6 11:18,0
5,神一样的原作！水准很高的动画化！,2013/10/3 8:55,0
4,兵长帅炸了，几个动作戏设计的不错。,2018/8/29 15:37,2
4,燃点颇高,2013/6/30 10:21,0
5,第三季后重看，改为5星,2013/7/15 20:25,0
5,很久没有这种热血沸腾的感觉了……,2013/10/2 14:29,0
5,巨人的巨无敌神作之处只要坚持看下去就一定能感受到，制作精良，剧情紧凑 人设硬核 既没有男女制服的差异，也没有对女性角色消费性的性意味描写，写了极其认真的女生间的情谊  所有青少年都可以看的新番 献出心脏！第三季走起,2018/7/9 8:43,2
4,神烦中二洗白，不过剧情还是带感,2013/9/15 11:38,0
4,什么都无法舍弃的人，什么都改变不了。,2013/9/29 22:08,0
4,2015.1.24 一开始那10来集男主真的够讨厌的，但是渐渐变帅了有木有。。。剧情也揭开冰山一角，越来越有趣了，我想我会赶紧买单行本=。=,2015/1/24 1:14,1
5,热血，好看。如果要追究巨人的真相，恐怕不外乎阴谋论了，就目前的设定而言还不至于荒谬到要归结于“做梦论”才能自圆其说,2013/10/7 15:35,0
4,设定本来是无敌的 就是太拖了 画工又差。,2013/11/26 3:24,0
5,神作,2013/9/29 20:55,0
4,10,2017/4/3 22:15,0
4,热血……热血……日本特殊的地缘政治和国际环境隐喻中的童话,2013/10/9 22:37,0
5,人类的探索心啊，不是因为别人的劝说，就能被轻易压抑下去的。,2016/8/28 12:09,0
5,第一部动画最震撼了，高开低走的神作。,2022/4/17 20:37,0
5,我又中二了。。但是真的很讨厌追剧啊。。。囤个十年再看会不会就没激情了= =,2013/11/25 0:47,0
4,#可耻可贺的补番#严重拖延看完了最后三集，无论是画面还是理清故事线，动画版足够对得起原作了，只是现在连作者都快搞不清自己要画什么了，第二季不走原创的话就遥遥无期了…,2014/1/13 14:41,0
5,这就是所谓的好钢要用在刀刃上吧？泽野弘之担当的10月新番KILL LA KILL同样值得关注,2013/9/29 22:12,9
5,好久没有这样看上就停不下来的了。。。,2014/4/15 7:04,0
5,这主角各种美，巨人各种二啊猥琐，这……,2013/5/29 15:35,0
4,什么都无法放弃的人，就注定无法获得成功。设定是有趣的，但情节推进缓慢。,2022/9/15 22:45,0
4,老套热血，为了丑萌的巨人加星星，奇行种跑起来乱扭屁股太好笑了。还有炫酷的亚妮。好多疑问，等第二季。,2015/2/8 10:21,1
5,战斗是真的会死人的,2024/4/26 21:57,0
5,主题是右倾思想的法西斯片，满满的侵略主义。但是很好看。,2013/8/25 11:45,0
5,四月新番最大惊喜!,2014/2/27 19:01,0
4,必须做出牺牲才能获得。 #后期的剧情略无力,2013/10/5 22:32,2
5,希望不是另一个坑，鬼道类神作，集数在控制在50之内比较合理。,2013/9/29 14:26,0
4,挺过瘾的，就是太慢了,2013/9/29 18:20,0
5,燃就一个字,2014/5/20 20:04,0
4,节奏走的好快 感觉有狗在后面追 不过看的好爽:3,2014/1/21 2:56,0
5,一天看完 点赞赞赞赞赞,2013/8/4 12:55,0
5,不自由，宁勿死。,2013/9/29 17:00,1
5,燃！分镜做的最好的动画之一，真的做的相当细致良心。可是我能发起一个联名要求换男猪的行动吗？中二无脑又不举的是要闹哪样？！我心里的小巨人都在咆哮了！！,2013/9/29 14:33,0
4,足够热血,2013/10/2 0:15,0
5,13年度最强番有的辩？好几年没看过这么燃的作品了！剧情设定都是一流的！大赞！！！,2014/1/11 13:36,0
4,有几段BGM太燃,2014/2/13 1:58,0
4,过瘾 但后来剧情淡了,2013/9/9 0:15,0
5,一米六的梗玩不坏。,2013/10/17 21:43,0
5,荒木哲郎,2013/10/9 1:41,0
5,制作水平不错,2014/10/13 16:52,0
4,兵长和艾伦好有爱哈哈哈 巨人的万种形态也很妩媚哈哈哈,2013/10/4 15:13,0
4,一些原创的地方，比如兵长下令弃尸什么的，很加分，动作戏也赞极了。漫画版相比之下真是后妈。,2013/10/10 13:04,0
4,自己看的是相当热血的，音乐是相当有激情的。,2017/5/17 23:08,1
5,巨人变身跟孙悟空变猩猩一样，居然要条件，悟空需要月亮和尾巴，艾伦需要目标和流血……拔了尾巴就退化，拿出真身就消失……只是巨人把煽情都放在了桌面上,2013/10/31 22:35,0
5,这大概是我目前为止看过最黑暗的动漫了吧，每当剧情发展有一丝希望的时候，下一秒绝对会被更强的绝望冲击，人性剖析的相当到位，人物性格塑造的很成功，总觉得艾伦好像鸣人啊……,2013/10/13 2:53,0
5,美术当然是无可挑剔，不过后五集的叙述模式、情绪传递才是真正的惊喜。哪怕故事本身有俗套的成分，甚至艾伦的形象也没有很颠覆，但是一旦感受到剧本精妙而扎实的铺陈在结局很自然地冲向顶峰，还是忍不住赞叹。本来看完前十集觉得不免有做作和浮夸的日本作品通病，结果后五集结束，这喷不了这是真五星。教堂被巨人的身躯瞬间压倒，和开头那个拿着教义被巨人蹂躏的说书人小小照应了一下，盲信身外之物是没用的，人类只能靠自己，这是老生常谈，谁让《巨人》选了最讨喜的那种表达方式,2024/8/11 0:07,1
5,爽毙了好吗！！！,2014/5/9 18:56,0
5,op好燃画风好赞,2013/7/15 11:33,0
4,前几集制作精良啊，动作很棒，让人很想看下去。。至于传说中非凡的气魄。。。驷马奶。。还没看出来。【是因为有熊孩子说剑风传奇抄巨人我才有好奇心的好么。。】,2013/12/30 20:23,0
5,好久没看动画，我又最喜欢矮子呢,2013/9/29 17:23,0
4,补标,2022/6/8 21:16,0
3,巨人吃人好带感，怎么不第一时间把男主给吃了，这种中二刺猬头男主不要太多好不好，看了就想上去给他两脚。,2013/4/28 23:56,348
3,一个审美有问题的关于被压迫的东方人民反抗西方列强的故事,2013/4/18 9:29,244
3,这剧的萌点到底在哪里……勉强3,2013/5/19 21:16,31
3,跟黄金时期的那些是不能比了。。。还行吧，就是主角太2了，也没出现什么特别有人格魅力的角色。。。,2013/6/10 22:52,58
3,真是被吹高的「神作」，对于主角开挂实在是燃不起来了（已看到第七话，还补了漫画，别说我不懂,2013/5/24 8:36,23
3,追着看到了第6集，就前5集来说，四星没任何问题。第6集节奏猛的就掉下来了，这是创作大忌但是商业常用的拖剧情手法。好在7、8集又抬了上来，但是9、10集掉节奏不说，剧情也变的超弱，一味靠配乐和镜头支撑，如果下一集还是这样，就要扣掉一星。——11集果然还是烂下去了，扣星。,2013/4/30 3:44,11
3,"对力量悬殊与徒劳因素总是没辙.但这并非切合我期望的故事,或许燃尽才智体能勇气尊严而活尊严而死就够养活我,它给的更多,不代表能够下咽.涉及价值判断军政观点分歧总无所遁形.要我说这又是部灼烧着愤怒的片子.叙事近全程死相,影像表现也不稳定,德土横山江崎丰神昙花一现无力挽颓势.三度放送事故闻所未闻",2013/9/29 12:33,9
3,之前觉得是过誉，人设渣渣，男主毫无特征，女主尚好。第五集开始，全面暴走，马上从3星提到5星。那种残酷，实在，太给力了。遗憾的是，13集开始，又玩各种拖剧情，令人陷入蛋疼的漩涡直到完结……这么多集数，却是各种无聊的对白，极低的信息量。3星算是打满。,2013/4/8 15:40,12
3,"男主性格阻碍了我继续看下去，本事低微脾气贼大，内耗严重还不分好赖乱发脾气，没有一点自知之明，没法忍受到他成长了，尤其冷静理性的mikasa还要照顾他，让人不舒服。
同样是男主角，和路飞真是天与地的差距。",2023/7/8 15:43,18
3,整个世界观都很不错，因为听室友讲过至今漫画的剧情，所以看动画觉得进度也太慢了……但更难忍的是男主的愚蠢和咆哮……都这个年头了，真的还需要这样的主角吗？至于画风和分镜，emmmm各有所爱吧，节奏还蛮跳的，有几集都不知道在讲什么。立体机动装置蛮帅的，但物理老师真的会气哭。,2017/9/30 21:38,17
3,其实这样的路子是后启示录风格里的下品。过早的设置了单一的价值观，那么整本作品其余的部分也不过是完善这个价值观罢了，其他所能看的也只有是设定的猎奇和兵长的身高了。。要我说日漫中的后启示录神作，首推还是北斗神拳，拳志郎可是直接承袭自疯狂的麦克斯2的废土路线的。。其次可以是望乡战士~~,2015/9/2 23:04,10
3,亮点：以墙内比喻被动、遵从、蒙蔽；墙外比喻主动、探索、未知，上接国际化，下接天朝实情，尤其是对后者一针见血。,2014/1/12 1:20,8
3,25集就这么过去，人类形态下，艾伦的巨人讨伐数依旧是，0（印象流）。最后我印象最深的妹子，居然是佩特拉。荒木是个好导演，泽野是个好作曲，于是我觉得自己看了个史诗版本的中二王冠……,2013/9/29 16:01,4
3,没意思,2014/1/19 21:22,9
3,搞了半天，原來是奧特曼打怪獸,2013/11/20 22:20,4
3,拍的真好，不過荒木哲郎的巔峰依舊是《學園默示錄》。,2017/6/20 18:01,3
3,打开开头仿佛回到七八年前。这遍终于看完了。别的都不说了，对于整部剧的价值导向依然存疑，人物每次陷入困境就不断地自己给自己洗脑，简直是社达语录大放送，然而实际上最强大的明明是主角光环，中二程度令人窒息……,2021/1/8 1:03,6
3,不仅所有角色都自怨自艾，而且还能持续不断来来回回的自怨自艾。,2019/6/9 14:27,6
3,最后一集感觉什么都没讲么……摔！整部片子画风略粗糙（后面好像有好转），剧情拖沓。虽然的确很火，但相比钢炼之类的依旧差两个档次。,2013/10/4 21:00,5
3,难得重燃日漫激情，求无聊，果断弃,2013/12/18 23:26,1
3,巨坑,2013/9/30 18:53,0
3,又是一部也就那样的作品。嘴炮真的就不能少打一点吗？哪怕少说几句也好啊。我算是知道为什么日本为什么hentai那么多了，他妈的那么爱说教，人都给你们bbb疯了,2014/12/14 15:05,8
3,制作精良。剧情还好期待后面发展。男主真是除了会变巨人之外一无是处………,2021/1/28 10:51,11
3,设定挺有意思的消遣作，角色设定吸引年轻人，换点成年人当主角少装逼的话能上升一个层次。,2016/1/29 0:11,5
3,说实话很好的作品，声优强大人物饱满。唯热血主题无爱。,2013/10/12 18:38,1
3,后继无力啊，是缺钱吧。,2014/4/6 20:38,0
3,第一季完结，我居然为了配合年轻人的口味看完了，优秀的动画有那么多，为什么偏偏这部这么火了呢。不管怎样2013年的100部达成，没想到今年最后一部是这个,2013/12/1 15:10,0
3,我真的完全无法接受动画的节奏了,2014/2/25 21:02,1
3,看了一个合集(﹁"﹁)我想我已经过了热血的年纪,2013/11/24 22:42,0
3,看到最后莫名乏味，像好几天没喝水已经渴的不得了。一想到故事还那么长就觉得累OTZ,2013/11/10 13:06,2
3,人物的刻画还欠火候 鬼喊鬼叫的,2014/5/25 23:18,2
3,主线剧情推进慢，比较中二，一直在那喊来喊去的受不了。,2019/9/11 11:15,5
3,前半部不错,2014/3/12 17:31,0
3,已厌倦日漫里的天赋异禀。,2013/11/23 12:06,0
3,兵长帅cry!对搬块石头搬好几集在森林狂奔好几集变身又好几集的进度无语了= =遥祝第二季流产,2013/9/30 20:20,0
3,他怎么没说还没完，就知道要白高兴一会儿。,2013/11/19 0:10,0
3,好虐。。。,2014/2/4 9:04,0
3,弃,2013/7/30 21:36,0
3,好的开始，不过神作远远谈不上，自从巨人即人的设定揭露开始，各种可能性已经差不多终结啦，动画的进度也实在值得吐槽,2013/10/20 11:42,0
3,【作者创作原型初衷及意识形态传达略微妙,2013/10/1 13:09,0
3,你可以再猛点口味轻那对拉拉好有爱,2014/4/12 20:47,0
3,感觉好变态~~不喜欢,2013/8/1 22:06,0
3,这个啰啰嗦嗦的玻璃心男主真是要了我老命了，要不然变要不然不变啊，要不然上要不然不上啊，每集花15分钟在那内心呐喊算什么事！,2013/10/21 12:48,0
3,每个人都是他妈的哲学家，每个人都在大喊大叫，看的我头痛死,2013/9/15 18:06,1
3,现在觉得有点好了哇~~~,2013/8/22 22:54,0
3,女巨人一出场开始格斗，就知道她是谁了。如此一来变成了人类开高达，注定了原本人与神之战的磅礴变成了狭隘的人类内斗，也注定前二十集的世界观铺垫必然无法填好，烂尾是必然。,2024/2/23 22:57,1
3,日漫就是坑多、拖沓。看了两集，看个剧透，完事。,2014/5/6 20:22,3
3,原谅我不懂你们日本的中二文化……,2018/11/25 11:14,2
3,思来想去既然我不这么不喜欢还是弃番吧，原作在我看来就相当麻麻，除了击中人们的猎奇心理，在一般少年漫里完全不算出彩，动画的制作的确为漫画做了太多修饰，但仍掩盖不了剧情孱弱的问题。那些大黑边我真是忍够了！17,2013/8/10 22:45,0
3,再也找不回以前看动漫的激情，看不下去,2013/6/19 13:36,0
3,即使一直吐糟也居然看到半夜2点半？！…,2014/4/13 17:26,1
3,准备要弃了,2013/8/18 12:53,0
3,虎头蛇尾的事情见得多了，但还不至于到弃的程度。不过整体用色风格相当喜欢,2013/9/30 1:50,0
3,剧情拖沓，设定解释太多了。虽然人物都很有个性，最喜欢白薯妹那个hentai~！,2013/10/1 0:07,0
3,仇恨太多，看得很腻~,2013/11/6 23:04,0
3,如果你什么都没有办法舍弃，那么就什么都改变不了！,2013/11/7 21:20,0
3,不明白为什么会被以神一般的编剧被推荐。。。刚开始介绍巨人都是男性身体的时候我就猜后面会有女巨人粗来了。。。后来alan被活吞我就想他应该要变身了吧。。。再然后女巨人粗来了还有智力，我想个么应该是国王搞的鬼。。。画面质量一般，音乐还成，但是时不时的内心os很烦人 拖沓,2013/11/26 10:17,0
3,怎么那么啰嗦呢。。赶紧变身超级奥特曼啊,2013/7/21 12:15,0
3,人物很纸片化啊，故事除了最后的大逆转之后还蛮土气的。如果这样算一番神作，那么来自新世界算什么,2019/7/21 16:16,3
3,终于养肥  可惜不想看了 24集弃 越看越渣 尤其一整集他妈的十几分钟都在哭哭啼啼纠结纠结的回忆   就五分钟新内容 操,2013/10/29 18:54,1
3,实在觉得看不下去。。。。故事背景看起来还不错，但是未来人类为什么还处在冷兵器时代？科学技术落后也不至于连化学这门科学倒退，而物理学倒是进步了发明了厉害的勾枪？！什么逻辑！片子也没表现什么人性，罗里吧嗦。各个人物性格止于干涩的交代并没有表现丰满，少年奋斗类漫画框架，老土没什么突破。,2013/11/24 20:04,0
3,我觉得这本动漫就好在人物性格变化起码还有迹可寻,2013/12/14 12:27,0
3,最关键的城墙居然被人家一撞就塌，豆腐渣工程呀这是,2013/10/11 11:05,0
3,进度真慢,2013/9/30 9:46,0
3,第一季看完了，不是很好玩,2014/1/13 13:24,0
3,还有第二季吧，虽然不知道什么时候,2013/10/5 23:21,0
3,不知道为什么，看完心情一直闷闷的。,2013/11/1 23:36,0
3,对动漫无爱,2013/10/14 19:36,0
3,慢又拖。,2013/9/21 17:27,0
3,最后还是坏掉了，嗨过头，做作了。,2013/10/21 23:43,0
3,题材设定的有意思，有些隐喻在里面，只是太拖沓，文戏注水多，这个系列不知要出到多久才是个头。不是很喜欢这种巨人与巨人对打的情节，搞得跟机甲一样，里面的咆哮太多让人不耐烦。另外我觉得普通的巨人长得很囧，表情和动作都很可爱，一点都不可怕。,2014/2/5 18:58,1
3,呵呵,2014/2/24 1:57,0
3,制作已经很精良了，但是说故事的时候太仓促了。,2013/11/26 10:20,0
3,弃了,2013/8/26 21:43,0
3,节奏太拖沓，就想着做两季好骗钱，做成30集就是佳作了,2013/10/11 9:39,0
3,一部放完故事还是很莫名其妙啊，这应该是长篇的节奏吧？可是脚本总是走的很奇怪。。。有所谓的爽文，这大概是爽片吧。,2013/11/13 21:55,0
3,闭关锁国最终会被毁灭，人的内心何尝不是如此？。。。最后两个巨人在OOXX，居然被人给打断了。。。还有，他们拿的不是大号的美工刀吗？。。。还有以为会更多表现更多角色成长的戏份，我错了。。。,2013/12/14 23:30,1
3,漫画党,2013/6/9 7:40,0
3,就不能好好说话么……,2013/7/7 10:51,0
3,2.9 我也撑不下去了，17集弃……第一集之后就没高潮过，动画制作太烂，分镜节奏神马的通通糟糕……还是追追漫画就好>^<,2013/8/4 22:36,0
3,血肉横飞,2013/9/29 21:23,0
3,第八集艾伦就开挂了，后面怎么演╮(╯▽╰)╭要是中国人民老早就把巨人煮来吃了〜,2013/6/25 1:13,0
