rating,comment,time,votes
3,感觉看了部动画版的中期周星驰电影，很多笑点有即视感。制作和节奏不错，但是我确实不吃这样表达的父子情和友情，大圣最后那种激昂感更好些。,2019/7/18 21:35,16
3,非常适合市场的一部讨巧之作，的确无论从故事还是整体效果都比大圣更扎实，却也丢掉了最纯粹的核心。最后哪吒的我命由我不由天，特别微妙。倒是敖丙塑造得更完整合理。PS：这其实是写给周星驰的告白信吧。,2019/7/28 23:42,4
3,尬中带点好看，好看中带点难看,2019/8/5 21:57,8
3,这么好磕的一对CP被浪费了，导演似乎并不了解什么叫「羁绊」。同根同源，一卵双生，一个是宿命，一个是责任。总觉得这样的设定可以有更多可能性，更多冲突感，而不是仅因为这样儿戏的理解和简单的感动就能携手赴死了。,2019/7/31 23:29,14
3,从大鱼海棠到这一部都是同一个问题：砸了大量精力财力在画面制作上，但就是没有找个人好好写剧本磨台词…生硬堆砌段子真的非常让人出戏阿。,2019/10/14 11:56,11
3,必须承认对待传统题材的文艺作品，我的口味还是趋于老派保守的。先不论剧情改编，单就里面的许多细节元素的“再发挥”就太让人出戏，比如山寨“奇异博士”的李靖、殷夫人的整容脸、太乙真人的油腻姿态、水晶宫的炼狱化… 尤其敖丙那对长得像激爽口味珍宝珠棒棒糖的兵刃，简直造成生理不适。只有陈塘关李府管家的形象是基本参照老版的，一丝安慰。还有申公豹的脖子并没有歪，是不是怕犯什么忌讳？,2019/8/3 23:48,6
3,看得出进步明显的动画制作，但故事设计与并不好笑段子堆砌还是不免使人尴尬。★ ★ ★,2019/8/1 8:47,17
3,失去了精神内核的哪吒只能算个中二少年,2022/10/11 8:43,29
3,撤换掉79版的反父权主题，大概也有基于「合家欢」的定位考量。新版想要完成的新命题「抗击偏见与命运」，但整个故事没有有效撑起对主题的阐述，说着「我命由我、不由天」的哪吒，最后还是活成了人们希望他成为的样子,2019/7/27 14:26,7
3,当成作者电影看，是杂糅了新旧两个主题的热血国漫：旧的是反叛精神，只不过哪吒的反叛对象从父权社会转移为个体命运；新的是刻板偏见，陈塘关百姓与天牢龙族皆不外如是——这个哪吒的真身其实叫鸣人，这个敖丙的真身其实叫佐助；魔王其实不叫魔王叫九尾妖狐，龙族其实不叫龙族而叫宇智波；魔丸和灵珠就像阿修罗与因陀罗；申公豹和太乙就像带土与卡卡西。作为商业电影看，笑料低俗并非问题，但抖机灵和真幽默尚存差距；社稷图的套层时空其实可以剪出最后一分钟营救，爱踢毽子的小妹妹其实可以作为敖德萨阶梯上颠簸的婴儿。,2019/7/28 23:52,11
3,①笑料廉价又出戏，几近失控；②台词生硬和说教之处，比比皆是；③哪吒的人设徘徊于京油子和熊孩子之间，反正跟可爱不沾边；④敖丙有一种莫名其妙的偶像负担，俨然就是个动画版的流量明星；⑤优点是情感充沛，太乙真人也算塑造得比较成功；⑥总而言之，国产片任重道远，这个水准只能算是堪堪及格吧。,2019/8/10 1:12,5
3,剧情和台词太弱了，我强国这么多年来不重视文科的结果就是连个故事的逻辑都没有，一味追求为燃而燃为黑化而黑化。我强国这么多年来也没有“实现自我”“生而为人都是独立个体”的思想观念，自然本片也说不出个所以然来。此外，哪吒一个三岁小孩搞得跟中年男子一样油腻，这就是我强国的审美情趣吧。支持国漫，特效真的很不错，十分拿得出手。但若批评不自由，则赞美无意义。,2019/8/10 0:31,10
3,难道不觉得尴尬吗？,2019/7/25 10:06,19
3,敖丙好美啊~我懂了大家为什么萌藕饼CP了。不过，敖丙这样修长的身材，不是该用剑吗？两个大锤子是什么鬼……改编很温暖，但是我还是更喜欢那个割肉还母剔骨还父的哪吒。,2019/8/5 17:05,10
3,都是上流社会在折腾，愚民只有跪拜的份儿。,2019/7/29 6:16,36
3,真的只能三星啊，中二可以是特色，但也依然是缺点，不能因为说的是小孩儿就降低标准，哪吒这个人物感觉只会喊口号，没什么成长性。。画面是很好的，山河社稷图很牛逼。但是在意识形态和思想性上层级太低了，比那几部大字头前辈都差很多啊，和哪吒闹海那种悲剧神作那就更别提了。。,2019/8/9 2:54,8
3,剧情太尴尬了，演到后边只能强努着编。哪吒自我阉割，救国救民了。真是呵呵。画面和一些笑话可以加一颗星，做动画的人才知道不容易。但的确太尴尬了……,2019/10/20 23:30,14
3,这片没有编剧或者有一百个甲方灵机一动,2019/7/27 1:36,32
3,外表精致完美的动画制作不是内核粗鄙混乱的遮羞布。想要立意深刻，却又怕不够迎合大众，整部电影全在这矛盾之中摇摆，打动不了人。,2019/7/27 1:01,35
3,评价这么高，有点惊讶，可是我真的觉得这部片子非常好莱坞，除了人物是古代的，其他没看见什么古典元素，不知道国产动画这样做下去有何意义,2021/10/27 22:52,21
3,不忍心批评，因为很多东西已经做得足够好了，社稷图等等想象力相当可以。搞笑比较低级，这个问题还好，但大剧情的逻辑设计和关键节点设计都十分糟糕，靠着良好的节奏能糊弄过去了,2019/7/20 23:09,27
3,虽然人物和故事感觉不是很立得住，但国产动画的技术水平让人很感动了,2019/8/4 15:30,7
3,特效的确炫目，但是内核精髓没了，而且我不认为这版哪吒动画人物塑造的比老版好，这种失去了中国味道的动画真的就是中国动画的进步吗？另外，一直卖丑搞笑这种习惯，真的是大话西游看多了，能别模仿了吗，幽默搞笑≠扮丑作怪。三星给龙太子吧,2019/7/31 21:23,23
3,陪孩子看完。别的不谈，叙事层面真的比不过79年的《哪吒闹海》，那一版人物性格分明，情节发展脉络清晰，且同样是反抗主题，79版电影反抗的对象是清清楚楚的。然而这版里的哪吒到底在反抗什么？感觉从开始到结束一直在变来变去，只有母慈子孝反而被演绎得比较生动。其实从哪吒这个人物形象的变化中，是可以看出很多问题的，比如编剧如何处理“异质的存在”？至少在这版中，我看到的是被天命异质化的哪吒在不断希求被主流接纳，这其实是一种非常保守（平庸）的态度。40年过去，这就是改开的阶段性成果吗？,2020/1/20 20:39,16
3,剧情完整度很高 不容易 但是笑料很尴尬 高潮戏非常好 长镜头打得眼花缭乱 哪吒变身也很燃 主题曲哪吒非常棒 配乐也都不错 但还是没大圣那么戳 应该是因为没有男友力并且我不腐吧,2019/7/20 22:17,22
3,《哪吒之魔童降世》在传统传说里脱胎出一个全新的故事和人物，看起来反叛传统却保留着最中正的热血和感动，一气呵成，气质独立。“一个周星驰式的动画版的哪吒”，在这样的暑期档显得难能可贵。画中修炼的部分虽然精彩，却只是热闹了一番，缺少了动画所才能呈现的超乎于故事审美之外那种惊艳，缺少了一个真正嗨上去的高潮，这一段想象力不够。,2019/7/19 10:48,44
3,但他究竟对抗了什么？命不由天 不由己 却只是由人,2019/8/18 19:39,6
3,兩星半。價值觀的偷渡。鼻屎怪的上岸覓食證明了妖怪會吃人，光是這點就讓妖族人族之分不可能僅止於哪吒以為的種族歧視那般簡單，而是赤裸裸的種族食物鏈之爭；而哪吒源於魔丸這個新設定讓他的叛逆僅止於罹患了超常力量的ADHD，父母之命和自我追求矛盾的傳統命題則被拔去扔到男二敖丙身上，也讓哪吒的片尾說教不免有種站著說話不腰疼的偽清高。,2019/8/19 1:12,10
3,A children’s song of ice and fire。基本上是拿来的，包括重复《大圣归来》，但仍属于比较丰富的好莱坞式产品了。逆天命的人不止一个，但天庭到底是啥姿态呢，没有血肉，愚民的转变也不可信。大量动作特效展示外缺乏更多的人物细节，仿佛人物都在刻板地等待那个去标签化的时刻。太主流了，说教，且不能放弃取悦那些会被这些段子取悦的观众，一个娘炮梗至于反复使用吗。,2019/7/30 15:20,10
3,魔改版哪吒，没那么好，就是一个还行的水准。反骨的内核把哪吒塑造成了一个孙悟空式的形象，这样做虽然也没什么不好，不过还是更希望看到一个本原的既叛逆又讨喜的哪吒形象。而且文本上的笑料太恶俗和偏见了，充斥着的笑话和故意歪曲的形象都让人感觉生理不适，人物就不能好好说话了吗，要吸引低领受众也不是这个办法呀，只会显得很low。倒是亲情线的展开算是不错的。动画的工业感虽然还不能和好莱坞顶尖比，但进步是很大的，至少打斗戏的设计挺流畅，场景的搭建也有些想象力在。整体上是好看的，如若能抛弃不适宜的喜剧表达可能会更好,2019/7/19 16:55,71
3,剧情神奇，笑点尴尬。中国神话里面统共就一个反抗父权的哪吒，居然被改成这种父慈子不孝的变形计剧情你在逗我？换个红孩儿都比这看着舒服。敖丙美少年和龙族做错什么被你们李家这么折腾？？陈塘关居民怎么这么倒霉碰到这种总兵。,2019/7/28 17:59,12
3,不能接受哪吒被蔡徐坤改了命,2019/7/27 17:42,21
3,导演抛出了一个非常有高度的深刻问题，这个问题澎湃到抛出的那一刻就像漩涡一样吸引人，本来满怀期待想要看导演怎么一点一点给出答案填补这个漩涡，结果却偏离了主体绷着力发不出来。就好像一些医生，总能用最简洁的语言点出患者的症结所在，却无法开出可以治愈的诊断。往往电影的缺陷是在于过分精琢外表而忽视了内涵的重量，但这部电影却是反了过来，极富力道的构思却没拿出闪耀的剧本，想做成全龄向作品，却在形式外表上意外滑向了低幼化。配音、形象、动作良莠不齐，整体还有待提高。但对命运的抗争，对亲情的守护，对友谊的珍视，的确都令人振奋、感动。,2019/7/27 14:49,3
3,考虑儿童片定位，三颗半到四星是没问题的，现在分数虚高，所以三颗星吧。最大的悖论是结局：全片都在说不要在意别人的看法，最终的 happy ending 在于哪吒终于得到了世人的认可，全崩。但不细想就还好，特效出色，但无惊喜。http://t.cn/Aillz7Yd,2019/7/21 23:36,11
3,就质量而言还行……就合家欢（虽然段子挺下流的），但是我是看了网上的评价来看的，就失望。就这？就这！？我命由我不由天的命题诠释的太简单了。特效画面方面看得出国产是有进步的，但也就国外流水线水平，真的想不明白票房怎么这么高？,2020/10/26 2:44,10
3,還是無法接受這種畫風搬上大銀幕,2019/7/30 18:29,7
3,不要这样好吗…哪吒其实是个悲剧人物啊,2019/8/15 21:51,8
3,喷了，连哪吒都开始父慈子孝了。笑点我实在是受不了，请张全蛋滚出配音届,2019/10/11 19:08,4
3,“我的命，由我说了算” 然后他跑去受天雷了，龙三太：“他的命，他说了算” 然后也跟着去受天雷了，太乙真人：“我来帮你们！” 然后他也跟着去受天雷去了。除了人物立意被截肢以外，从剧情打斗和创意神马的来说，非常不错。不过，陷阱往往就在这里，形大于魂，画两个黑眼圈就说自己颠覆，却悄然顺从一些不可坑的宿命安排。你不能选择性叛逆啊，这未免有些鸡贼。说是叛逆，他到底叛了什么？是动画原形？还是视觉体现？说是消除误解，它又消除了什么？实际上就观众而言，我们都不曾误解过哪吒，他本就是个挑战父权的小英雄。现在反而变成了一个因为童年不幸而苦大仇深，还压制不了魔性的小混混！,2019/7/31 19:56,5
3,看了。【剧透】喜欢敖丙，龙族太惨，敖丙其实更像主角，背负了深切的恨，却保持了秉性良善，新的哪吒故事其实在反抗什么？旧版的哪吒故事中那段剔骨还父割肉还母是非常惊心惨烈的，与其他传统父慈子孝的故事形成鲜明明显，紧随潮流的国漫父慈母爱，生活在爱、宽容之中的，哪吒哪里不顺心，与敖丙比呢？敖丙如旧时主角，为新主角的崛起必要时须麻木挥动两个大冰球，整部片看完，龙族悲惨的命运没有被改善，申公豹对命运不公的诘问没被回答，其他的呢？没了，除了哪吒得到了普通人的承认，不再有人追喊他是个妖怪。,2019/7/27 21:44,3
3,就陈塘关这些百姓，哪一个值得认真对待？,2019/8/11 17:12,4
3,还行，本身三星半。 对哪吒故事进行的基于当代中国中产家庭价值观的好莱坞式改造。加上刻意制造笑点就三星吧。,2019/7/28 11:30,1
3,前几天重看了老版哪吒自刎的那一段，哭得不能自己。这一部是一部不错的动画片，但是我绝不承认是哪吒故事。,2019/8/4 21:51,5
3,补标。本来想二刷在评分，但是实在不会再看了。到现在我都很不喜欢这部片子，从内容到形式都是非常正统的美式故事，说得是反叛传统，实际完全背叛哪吒整个故事的内核，丧失了其中最重要的意义。 我不喜欢很不喜欢最重要的一点是：它并没有更深刻的讨论与思考，就仅仅是一个流畅的好莱坞故事而已。当然我不能否认饺子的才能，但是对于国漫来说，这bug般的存在……的确给了其他动漫不可企及的高度。 天时地利人和吧。但我不喜欢，很不喜欢。,2021/4/3 20:47,46
3,不好笑，但设定还算有新意，深度应该是不如原版哪吒的故事,2025/1/13 0:56,15
3,逆天改命，戳人痛点。技术足够，剧本不足。哪吒敖丙，过于好嗑。社稷图里，随便你玩。太乙搞笑，夫人略萌。,2019/7/29 18:09,2
3,一个集结马太效应和标签理论的报告，最后却告诉我们任何人都逃不出规训的囚牢，善/恶或正/邪简单二分法是我们希望下一代所承接的价值标准吗？此外，周星驰式的无厘头幽默向来不对我的口味，总感觉其中充满了对边缘/他者/地域文化的奇观化和对多元性别深深的歧视与讽刺。,2019/12/7 8:51,7
3,不知道为什么吹那么高 可能我不爱看动画电影吧 笑点都尬尬的,2021/2/23 21:49,10
3,7/10。对天命这种权威的反叛成为了叙事动力，哪吒和敖丙相爱相杀的这一对正好是天珠转世的一体两面：龙王对天的顺从并不能换取真正的自由，反而被囚禁于龙宫，而李靖用换命符逆天改命的行为，除了象征父爱力量下的拯救和开化，也体现了一个天命的秩序维护者（他不敢像妻子一样为生不出来叫嚣着砸祠堂），对权威最懦弱的反抗，结尾哪吒释放了乾坤圈封住的力量，托举起覆灭陈塘关的巨大冰块，凭借意志反抗了天命的选择，敖丙也选择与哪吒同生共死反抗了家族权威的使命。形式上不断做着对神权的消解：太乙真人变成骑着猪的啤酒肚大叔，申公豹说话结巴，哪吒非常“丧”的黑眼圈尖牙齿，都将至高无上的天神降格为世俗凡人，但讽刺的是叙事内核还是一个被温驯的异类回归正常秩序（成长为保卫百姓的英雄），传统又保守。踢毽子穿铠甲、庆生像办丧几处勉强好笑。,2019/8/19 21:29,11
3,到最后也没解决哪吒的戾气，此外，各位能不能别那么容易下跪。,2019/7/31 13:23,12
3,全场唯一get到的帅点在哪吒解开乾坤圈套进手里那边 笑点很多都是台词引导感觉一般,2019/7/21 2:05,16
3,我觉得不太行。除去哪吒的背景，故事旧台词僵配音尬，除去打斗外的背景细节都做得不够好；加上哪吒的背景之后，四不像，说教生硬，哪吒的画风尤其让我不喜，还有些擦边球的笑点讲真就不应该在全年龄向动画片里出现。,2019/9/14 14:09,4
3,人设还蛮可爱的。对社会气的台词有点接受无能。,2019/9/13 1:46,3
3,感觉期待太高 不过也不能说不好 水准的确也是在大圣 白蛇级别的 故事讲的通顺了 主要个人很不喜欢主角京妞铁T哪吒 和四川油腻相声演员太乙真人 里面笑点大多数都是周星驰式的笑点 如花梗 磕巴梗 屎尿屁梗 哪吒到结尾还是觉得很讨人厌,2019/7/19 22:38,5
3,没什么原创性，谈不上多惊喜，不闹海的吃藕哪吒看着有点闹心，自我陶醉的段子怕是要和隔壁《银河补习班》牵手，对后续封神故事兴味索然…烟熏妆小哪吒像是从《僵尸新娘》《怪兽电力公司》里走出来的…殷夫人怕是套用了《白蛇缘起》小白的建模…申公豹不就是结巴版乌木喉…灵珠附体的敖丙和变身后的哪吒还算养眼，但是没看到帅气的小哥哥牵手搞基我很不开心,2019/7/19 19:23,26
3,全程冷漠脸，最近这种套路的电影真的看的完全无感，哎～吃的多了，嘴就叼了，故事和技术都挺好的，可就是吃不下了……,2019/7/19 21:46,63
3,这是一个西式的哪吒。一个以西方式的将物我（妖、人、神）“外在化”看待的价值观为根基的世界。哪吒先天就背负“原罪”，通过自我拯救/自我毁灭与“救赎”的方式完成自我对环境的抗争，世界被看成“他者”（人定胜天）。这种处理方式直接威胁到了哪吒这样一个传统形象的诗意，但是与当下的意识形态却是符合的。,2019/10/18 15:58,5
3,你单纯的原创的话还行，虽然我其实不太喜欢一开始太乙的那些笑点……不过整个故事节奏和完整性还是可以。但你说这是哪吒……反正不是我的。可能我对他的设定不可变的部分太多，你将他重新解读，唯有灵珠子设定保留（顺便在我看来是角色身上最不代表他人性的部分）来说，就说明一定不是我喜欢的类型了。,2019/10/20 12:23,4
3,片中讲着四川话的太乙真人和飞猪，非常有趣。剧情和内涵也够深刻， 山河社稷图那部分是做的很不错，充满想象力又有很多惊喜。哪吒母亲塑造的最好 但是，它的问题对我来说，与其他我看过的很多国产品一样，就是太吵了。我不知道是否与影院的音响有关，真的比一般美国电影要吵很多。就是感觉角色一直在扯着脖子喊。特别是哪吒。他本来应该是一个很酷的角色，形象上也有趣，但配音真的很失败，变得声嘶力竭，很专横。感觉有时都能听到演员嗓子都撕裂了一样。这肯定与表演有关，也可能是导演执导有问题。但是其声音与表情并没有达到很好的结合。 其实很多时候没有必要这样大喊大叫去展示情绪的。这是国产片普遍存在的问题，就是表演用力过猛。音效也是，其实结尾的大战真的很长，视觉效果及变化性还是可以的，但音效太高分贝，令人耳朵很累,2019/8/31 14:15,5
3,制作和设计很不错了，为什么会有这么多低俗玩笑？扣鼻屎，掉着鼻涕，喝鼻涕，随地尿尿，放屁助力，烧裤裆，恋童癖？。。。这种引导竟然是给小孩看的？哪吒的性格转变有点突兀，缺乏更多铺垫。踢毽子的戏很喜欢。 @Tysons AMC。落地西方还是有困难啊。。,2019/9/11 11:50,5
3,笑点过于低龄化……总体一般吧，3.5星,2025/2/3 16:15,10
3,改编不是不可以，但我认为删去哪吒「断臂剖腹，剜肠剔骨，还于父母」的情节，就等于删去了哪吒这个神话人物最深层次的立意：骨肉可以还给你，人格、精神永远独立。电影想颂扬的是一种普世价值观，近年来流行的「我命由我」精神，很可贵。然而如若能从另一个维度去讨论亲子关系，我认为更能彰显哪吒这一人物的独特性。,2019/7/29 15:58,3
3,很多中国观众对国漫格外优容。,2019/7/29 19:24,4
3,有些梗，真的蛮low的…,2019/7/21 8:14,270
3,觉得剧情上和逻辑上不顺畅，笑点也没有很好笑。,2019/8/5 8:07,1
3,哪吒的配音演员真是不错，傲娇、顽灵都配出来了。看了眼照片，跟小哪吒还挺像，除了没有那么重的黑眼圈。其他：烈火灵童弑父、伟大的母爱、同胞竞争、同门相杀、在意外人眼光、希望得到权威认可，都是老话题，感觉没啥新意呢。哪吒与敖丙本是同根生，敖丙却跟做了医美一样。哪吒的发型不错，我一度很爱这个。,2019/8/4 22:14,3
3,一切的一切都没问题，也是完全符合市场化的，尤其整个封神榜的布局初现更是让人激动。唯一的问题这样改变哪吒让人从心底里还是有点拒绝的，当做一个全新的故事看吧，可当初吸引你进影院的可是那个充满反叛精神手拿红缨枪脚踩风火轮的哪吒哎。但基本上是一个全新的故事也不可谓不好，旧有的故事已太深入人心如果不大刀阔斧的砍去，观众难道不成又听一遍老故事，只是视觉新颖了？那这一部哪吒也不会有这么大新意和热度了。况且有编剧自我的世界观架构铺底，只是借用哪吒的人物设定而已，还是期待后续的封神故事新编。插科打诨我觉得也没问题，苦大仇深不符合大众审美的，这一点漫威已经印证了无数遍，插科打诨、磕cp、燃点、泪点才是一部当代商业片该有的元素。,2019/7/29 8:01,2
3,感觉还有点味道的除了李靖这个人物以外，就再也找不到别的，惊然发觉所谓“中国文化”到最后竟变成如此徒有其表的东西，这部动画除了用到中式元素，其更抽象的内在却颇具西方个人主义，人们欢呼“中国动画”的希望，这里的“中国”是一个地区概念而不是文化概念，到此我们不得不承认，在精神上我们已经完全被西方文化占领了，这部电影越是成功我反而越是五味杂陈。说实话，电影并不算很差，该搞笑的搞笑该煽情的煽情，传统的表皮中大量充斥流行梗的低级做法带来的违和感和剧情上的套路感作为给小孩子看的工业产品也完全可以谅解和忽略，然而我坐在电影院里怎么看都不是滋味，中国文化虽说不上是形神俱灭，也许形还在，但神却是灭了，在我看来，这到底不能算是“中国”的东西,2019/8/12 0:39,3
3,《哪吒之绝代双骄》 视觉效果、动作场面已经不是国产的问题；故事还在原地踏步。 哪吒是改魔、敖丙是魔改。,2019/7/13 19:24,12
3,请把那些一点也不好笑的桥段删光OK？,2019/7/27 19:37,5
3,制作满分，但我心中的哪吒是很悲情的形象，是为了自由意志、无家国无君父的反叛者，不是一心想融入群众的基层干部。但或许，这样的哪吒，就是当下中国应该出现的形象，每个时代都有自己的哪吒。方言、段子的运用和《大圣归来》如出一辙，当然这也是会戳中大众G点的亮点，但如此一来，这样的国漫内核实际上仍是在向好莱坞靠拢。,2019/7/26 14:19,6
3,7分，除了首次在国产动画电影里看到了一个相对完整的剧本以外，无惊喜，虽然在整个国产环境下拿出一个流畅的故事已经比较难得，但是从工业制作层面来说，和一些好动画相比差距仍然存在，so不差我这一个鼓励分,2019/7/17 21:44,2
3,打斗流畅，哪吒变三头六臂的时机抓的很好。但部分人物和对话恶俗尴尬。 以前的哪吒是剔骨还肉抛开所有挂碍终得自由的精神图腾，这个哪吒只是个求认同的中二少年，精神上的退步令人遗憾。,2019/8/11 21:36,8
3,大闹东海抽龙筋，削骨还父削肉还母，完成个人救赎化身莲藕，助武王伐纣跻身仙班。还有比这更波澜壮阔的戏剧吗？原故事的跌宕起伏让人物内心可塑性发挥空间巨大。我不反感影视从业者用摩登手法解构神话故事，进而改编重组玩出新花样。但魔童降世真的不得半点精髓，他跟哪吒没有一丝关系。创作者完全只取了些人物标本和神器装饰，注入的性格血液夹带过多个人色彩。角色之间的关系也颠覆的让人怀疑创作者是否具备基本的神话常识，龙太子身为海仙拜申公豹为师，出镜设定一副小受圣母心和抽他筋的哪吒邂逅做朋友，还试图整出个CP，这个世界就那么需要腐吗？只有李靖这个人物塑造立的住，李夫人配音用咆哮中二风，太乙一堆段子嘻哈，细云龙尴尬，人妖成见大道理直接劈头盖脑抛给你，你感动的稀里哗啦，可能是被配乐煽的。,2019/8/15 18:19,5
3,哪吒在我心目中的角色非张一山莫属，敖丙那么帅个大帅哥居然举两个棒棒糖当道具。。,2019/8/3 12:36,2
