rating,comment,time,votes
4,看到海报和预告片，人们第一反应就是：哪吒太丑了。 觉得丑就对了，因为本片讲的就是打破偏见。 正如很多人一看这是国漫，就不看了；或者去看了，看了觉得还不错也要自动先扣20分。 电影之中，骂哪吒是政治正确，只要你说哪吒是妖怪，就会有人跟着说； 电影之外，骂国产片、国漫也成了政治正确，只要你骂它，就会有人给你点赞。 其实哪吒不是妖怪，他也想降妖除魔洗清骂名； 国漫也不都是烂片，也有人想拍一部佳作证明自己。 比如这部《哪吒》。 山河社稷图一幕真是天马行空，震撼无比，将曾经只存在于想象中的物品具象化，也将中国神话的无穷想象力展现得淋漓尽致。 那些耳熟能详的故事，不再只是故事，而是能看到，能听到，能享受一场视觉盛宴。 今年有《哪吒》，明年有《姜子牙》，封神电影宇宙即将开启。 是时候以电影的形式让中国文化走向世界了。,2019/7/18 13:53,27001
4,邓超救不起这暑期档，哪吒可以。,2019/7/18 21:38,27189
5,卧槽居然看哭了，这才是货真价实的国漫新希望，终于不再是假大空的中国风堆砌，而开始借神话寓言塑造真正的“小人物”。背负原罪的出身，命中注定的死期，对存在的笃定和身份的动摇，竟指向《刺客聂隐娘》的内核：一个人，没有同类。完整的世界观构建，父子母子师徒兄弟友敌，每一段关系都处理的有血有肉全无敷衍。美术剪辑配乐动作设计，处处都是亮点，就连喜剧部分也绝非装疯卖傻而存在无数细节作为支撑。海边夕阳踢毽和社稷图虚幻仙境两部分堪称绝美段落，飞驰想象力和一流制作实力的结合，值得一刷再刷。严格说是四星电影，但愿意加满五星狂推鼓励！,2019/7/13 17:17,21812
5,年度最佳动画，不，年度最佳影片，剧作上的成熟应该让同档期的《狮子王》跪下来叫爸爸，起承转合水到渠成且饱含情感力量，这种成熟度不管是在动画这种形式里还是脱离动画都值得所有国产商业电影学习。整部影片看下来，在形式上非常现代化，包括笑点台词都贴近现代网络化的生活，是谓形散，但是影片把握住了哪吒这个神话人物的内在精神：我命由我不由天，并且自始至终都贯彻下去，是谓神不散，包括反派敖丙及申公豹都人物弧光饱满，在非我族类其心必异的人类世界里，《哪吒之魔童降世》是为所有异类书写的颂歌，这部片子就如同蔡依林在金曲奖上说的：献给那些曾经认为自己没有任何机会与选择的你，请你一定要记得选择你自己，支持你自己。,2019/7/14 18:12,16870
4,技术上还是当下国产动画电影的水准，但在剧作的完成度上，却是第一次这么成熟，这么优秀！以前大圣大鱼或者白蛇这些剧本有先天缺陷的庸常之辈，都被称作是国产动画电影的良心之作，直到这部哪吒，才算是做到了剧本层面上的优秀，兼顾了喜剧元素和主题深度，还为之后的封神宇宙开了一个好头，大家以后可以忘掉大圣了。导演把哪吒的故事做了颠覆性的改编，逆天改命的主题在哪吒身上爆发了耀眼的人物弧光，最后哪吒直接对着电影院里的观众说，今天是我生日宴，你们谁都不准哭，这一刻的泪点实在是太可怕了。第一次给国产动画做自来水，在这个萧条的暑期档，这部肯定会是爆款。,2019/7/13 23:20,12722
5,牛逼！牛逼！牛逼！4年前翻着白眼看完了《大圣归来》，4年后热泪盈眶地看完这部《哪吒之魔童降世》。没想到2019不仅仅是中国科幻大片元年，本片更是和《白蛇：缘起》一块儿创造了国产动漫作品前所未有的高潮。扎实的故事，生动的角色，饱满的情绪，炸裂的场面，这一切都构成了110分钟云霄飞车式的、畅快淋漓的观影体验，表面上是哪吒的传奇，骨子里面是《绝代双骄》+《悟空传》，毁天灭地的逆天气势更是燃破天际，好一曲震撼人心的“冰与火之歌”！都给老子去看！,2019/7/17 21:22,11902
5,牛逼了！没想到国产动画能把故事内核写得这么成熟，远超《大圣归来》。好几场戏被震撼到，必须五星鼓励了。将“水淹陈塘关”的故事元素打碎了重构，人设和剧情完全依照阴阳哲学来做。太极生两仪，混元珠分为魔丸（火）和灵珠（水）。太乙真人与申公豹，哪吒与敖丙，皆是一体双生。命运的偏离带来了秩序的倒错，于是，善与恶的边界变得越加复杂起来，耐人寻味。每个主要角色都带着宿命感，向死而生，阴阳相合打破命运。哪吒形象很颠覆，华语电影里也是难得一见，最重要的反叛精神立住了。导演想击打全龄观众，而那些嬉笑段落在关键时刻也催生出了悲情，让人泪目。高潮部分的场面戏够燃够磅礴，而且情绪饱满。以后再出国产动画，都将和它比较。,2019/7/13 20:52,10845
4,“所有龙把鳞片扣下来的时候，我真的感觉敖丙压力太大了。”“我们全村可就指望你一个人去考大学了啊，一定要上清华啊。”“就算把其他报清华的人都杀掉你也一定要考上啊！”,2019/7/28 22:05,5821
4,这个夏天还有比“藕饼”cp更火的吗？,2019/7/19 11:38,7426
5,“不成，功变成仁”、《神仙的自我修养》、“申公公”、内服外敷效果都一样的解药…前面快笑死；指点江山笔、英气的敖丙、猪鼻子倒带器…中间各种神来之笔；“人心的偏见是座大山，你是谁只有你自己才说了算”、父母面前的生离死别…结尾又被感动得一把老泪。老妈的性格更立体，老爸李靖对哪吒说你的真实身份其实是…时，生怕他说出个“蛋”，这是这部毫不正经却又硬气热血至死的片子能干出来的事。集丧逼和燃于一身，在哪吒面前，没人帅的起来！锁定今年最佳国产动画。,2019/7/14 21:19,7676
5,休说苍天不由人，我命由我不由天。新的故事，改编的很不错啊，就是有点短。友情提醒：观影记得带纸巾,2019/7/19 11:37,5436
4,目前国产三维动画中的最佳。和年初的《白蛇》一道，富足想象力之下的经典魔改，在人物、情节和视听呈现上都冲着一股劲。但还是有些遗憾，双生的概念没有做得更加复杂深刻、部分低俗笑料虽有趣但跳线。可能是我期待太高了。,2019/7/18 21:23,3926
4,7分，制作确实非常突出，尤其是夕阳下踢毽子和变身两场戏，印象深刻。这也说明，华语动画只要真是踏踏实实下来做苦功夫，还是能出佳作的。剧情相比老版做了很多革新，包括新增的父子情，这个见仁见智吧。主题则是神魔我做主，我命由我不由天的中二少年感，放到现在倒是挺燃的。哪吒变身之后也是大加分，跟敖丙的兄弟情也是相当新时代趣味了。希望每一部用心制作的华语动画，都能有好的成绩吧。不过，个人还是觉得大圣更好些，所以，刚刚还专门给大圣改了分，这样才公平些。都好都好，都加油，都加油!,2019/7/26 16:29,1230
4,【B】这才叫真正的国漫崛起！美术，制作，人物塑造，立意都比大圣归来更好。最重要的是你真的能感觉到创作者不故步自封的力求突破，也终于在国漫里看到了一直缺少的“想象力”存在（虽然只是在场景，物件设定上这些较为基础的部分，但未必不是个好的开始），缺点是整体风格略显杂糅，笑点像港式无厘头，战斗场面像日漫，有的地方又有仙侠和好莱坞动画的影子，但最后个效果居然不错，而且对于仍处于摸索阶段的国产动画来说这完全能理解。另外，一个动画片的父子情都比隔壁《银河补习班》更真实动人，邓超和俞白眉请出来挨打。,2019/7/18 22:55,2078
4,一切都很好，但是哪吒，我想我看过更好的。,2019/7/20 16:53,1175
4,谢谢把我拍的这么好！,2019/7/19 21:40,816
5,暑期档到目前为止最好看的一部。真正打动我的不是哪吒的人设，而是找回了久违的看港片喜剧的快感！,2019/7/19 12:24,1445
5,神话故事新编，以一种不令人悲伤的方式来讲述悲伤的哪吒童年。丰富多元充满想象力画面；包含幽默、热血、感人和人生观点的剧情；还有安排得当的叙事节奏，结尾处高潮更是一波接一波，让观众又是激动万分，又是感动落泪，实在令人佩服，这就是一部优秀的动画电影。,2019/7/14 20:33,1662
4,承认期待不高，看得有些意外。我不是哪吒迷，而更接近封神迷——实为情怀的那种玩意，所以看到片方想要铺封神宇宙，无论成败，总归是有人在做这么一步，并且，这一步，作为起点是恰如其分的。不存在“哪吒就应该是代表/刻画什么精神”之类的说法，动画片也不是低幼倾向的文化产品。性格转变过快，密集迎合观众笑点之类的缺陷有不少，但来日可期，可以再打磨。,2019/7/23 16:39,348
4,点映看完了，不剧透地说，除了哪吒和他娘的人物关系外，这部电影把传统的哪吒故事里人物关系都改变了，哪吒和李靖、哪吒和太乙、哪吒和敖丙等等，因为有这些关系要重新做，所以这些人物的设定才和传统的不一样。整部电影本身严格按照商业片的形式，几个情感转折的节点都掐准了时间，不夸张地说，如果这个系列电影要做下去的话（还有之前的大圣、之后的姜子牙等），《大圣归来》和《魔童降世》在这个系列的地位相当于这个系列的《钢铁侠01》和《美国队长01》，但前提是一定要做下去。,2019/7/14 17:10,687
4,中国的封神奇幻故事是未来商业娱乐电影的大宝藏，这还只是个小开头！祝贺这位年轻的新编导。,2019/8/29 21:38,209
4,人不过就是半神半魔的造物，这故事按照这个路子衍生。整体非常工整，技术让人赞叹，自《大圣归来》到《哪吒》，这条从中国神话拿改素材的动画之路被证明是最经济实惠的。这里面其实有着另外可以深化的内容，就是几个角色的象征，哪吒像个为民请命的知识分子，但被庸众看作妖怪，他的叛逆不被理解和尊重，龙王是个归顺的反叛者，但被招安并不代表被信任，他的下场故事里讲得很清楚，而敖丙是甩脱出身帽子的唯一机会，而最终，这个年轻人和哪吒那个反叛者合二为一成为一个被大众颔首的理中客。这到底是成熟还是悲哀呢？只不过这个方向肯定不会被明确提点。想想有点悲哀，动画片的形式让这类作品成为了我们电影中最可能表达一些别样内容的容器，但也因为形式，那些表达最终被掩埋在搞笑和特效之中。,2019/7/26 16:13,367
4,几个小缺点：娘炮那个梗用得有点太多了后面就烦了，结尾大战有些拖沓，段子堆得有些太密集了导致最后情绪有点破碎。其他都很好，比［大圣］好，可能是这几年最好的国产动画，李靖太可以了吧。,2019/7/27 0:28,282
4,一出生就有黑眼圈的孩子肯定不简单,2019/7/29 22:08,275
4,C＋/ ①相比被盛赞的剧本，反倒是视觉形象的建构比较出乎我意料：莲-火-毽子（鳞片）-红莲的意象联结贯穿了全片，自细微琐屑至宏大奇观完成了完整回环而又颇具想象力的体系。②剧本其实有点过于依赖“孩童”人设，一方面助益了影片暗黑而又诙谐的混搭基调，另一方面也遮蔽了部分剧作上的仓促甚至让人物的成长显得不够充分（比如，“控制”的习得只是如此简单的事情吗？）。③导演对叙事时间的理解可能有些粗糙，连高潮戏一条线到一半时间停顿切到另一条线这样破坏节奏的小瑕疵都好几处。④至于大量不合时宜的笑料，让它们融入叙事的办法只有一个，就是添加让这些“异类”同样受到压抑的细节，而不是大大落落地丢包袱。,2019/7/18 21:56,249
4,刨去了哪吒自杀还父的情节，就抽去了哪吒故事的灵魂。我只能说，这是另一个故事，我只能说这个新的关于青春期的故事讲的不错，舞美、画工、形象设计都好。但，这是一部拍给80后的电影，为人父母的80后很爱看吧；养过利维坦式宝宝的80后很爱看吧；熟悉周星驰式喜剧的80后很爱看吧；把自己代入到李靖夫妇而非哪吒和敖丙的80后们很爱看吧。你们一定很爱看，因为你们已经不再是曾经那个哪吒，而是守着工资的总兵咯。一言以蔽之，这不是哪吒的故事，但不妨碍是另一个讲的还算不错的故事。片尾曲的歌也不错。值得票价，就是我全程到目前都醉着。,2019/7/28 1:13,262
4,跟“哪吒闹海”相比格局太小了，得了狂暴症的哪吒也不太讨喜。但创意和细节都值得嘉奖，还有N多熟悉的家乡元素。让封神宇宙来得更猛烈些吧！（这版的李靖我可以…）,2019/8/23 18:05,181
5,这是导演的动画长片处女作啊！,2019/7/28 0:10,258
4,童年时期，最难忘的一个画面就是哪吒自刎！这么多年过去了，又看到了一个看起来丑爆丑爆的哪吒。故事在原作基础上做了颠覆性改编，面子上不必多说，里子中关于父爱的感动，自我认知的成长，世俗偏见的以及反叛意识，都值得称道。还有很多现代化元素的融合也别有趣味！自来水安利，去看就对了…,2019/7/13 17:48,448
4,徐克+周星驰，精准复刻。,2019/7/26 21:17,88
4,这才是暑期电影应该有的样子，不闹海的哪吒，是文本与技术双成熟的华语动画。故事流畅、角色生动，虽然魔改，但整体路线还是以脍炙人口的大闹陈塘关故事为基础，且更符合当下文化价值。观感体验与大圣归来很像，笑料与热血并举。设定方面除了哪吒三件套外，山河社稷图、混元珠等设定都是源自封神的噱头，也有小云云、结界兄弟等可爱的原创角色。只可惜结尾大战意犹未尽，不算过瘾。至于画面嘛，制作水平早就不是华语动画的掣肘了，这部更是有着美观造型和时髦特效的视觉大餐,2019/7/19 12:29,299
4,3.5；较多低幼欢脱段子集合的表象并不能掩盖其悲剧的本质，越往后越动人，在改编原著的基础上，文本大刀阔斧地改变走向，奉献了一个在（国产）动画中难得一见具有邪气的魅力角色（取下乾坤圈，变身一刻堪称全片高光，碾压帅气敖丙）。善与恶，水与火，在充满偏见定论的二元世界，这两个承载了命运错弄的少年，最终以“我不信命”的信念发出天问，完满开启「封神」宇宙，十分期待了。申公豹和龙族的命运也非常具有意味深长的寓意，并为丰富主题的完成提供富含信息量的支线提供。,2019/7/19 21:30,230
4,用周星驰的元素做中国式的幻想喜剧3DCG动画电影，这样的模板，确实是个可复刻的方向……,2019/7/17 22:42,131
5,哪吒就是那种看完了刷评论压根不会点开差评去读的片子，一定要看IMAX。,2019/7/23 22:33,279
5,这个夏天一定会爆！以大家对大圣大鱼和白蛇的热情，这部国漫在完成度上圆满完成期待。第一次有了看好莱坞动画的流畅感和毫无尿点以及满满泪点，实在太不容易了。这次的剧本创作、节奏把握、主题升华、人物设定、视觉特效、巧妙笑点，皆弥补之前的种种短板，毫不夸张的说是一部集大成之作。期待暑期档刷爆豆瓣和朋友圈,2019/7/17 21:56,178
4,少年的你，有个小小的愿望，愿风雨云中，刀背藏身，一秒钟行八百里，刺破六欲天,2019/7/18 22:45,63
4,三幕设计和人物刻画比这几年漫威好看多了，完全是可以卖到全世界商业片。既然是就着好莱坞做的，我们就用好莱坞标准来评。,2019/7/30 2:26,51
4,可圈可点，可圈可点。 看的时候会默认四十年前的经典《哪吒闹海》的剧情走向，看着看着发现本片完全没有照搬原来的故事，而是完完全全讲了一个新故事，并且不再是个人英雄独角戏，而是成功塑造了四个主要角色，这一点太赞了。而要批评的则是开篇半小时打诨插科的小把戏太多了，可这毕竟是个叙事性的神话正剧，不是《马达加斯加》或者《玩具总动员》，所以分全扣在这里。另外，技术上还有待赶英超美。 顺便看到有人拿《哪吒闹海》对比，认为本片不如旧作的，我必须指出一个基本事实：《哪吒闹海》没有传说中那么好。它是文革结束后美影厂赶工出来的作品，技术上已经有各种不足；更致命的是它跟那个时代的很多电影一样，带着过度的政治隐喻，四海龙王就是四人帮，当无论左还是右的意识形态的灌输盖过了故事本身时，就很难做出好作品了。【佛永润广正佳】,2019/7/28 22:16,55
5,很像1970年之后的中国威胁论（魔童）、89年联合国制裁（关到死）、2001入世腾飞（当妖怪给他们瞧瞧） 和 2018年的中美贸易摩擦、华为事件（若命运不公斗到底）！2019最强国漫没有之一！！！,2019/7/19 13:54,159
4,人物设计父母的那个眼睛，有点让人发毛！反派师傅那个造型好像木兰里面那个太监哦！动作设计好棒好棒！最后高潮部分有一点点的拖沓，不过整体真的很让人惊喜了！我们小县城的电影院里男女老少哭得稀里哗啦的，没办法我们乡下人就是这么sentimental..... 最后，真的，好希望，自己小时候，学会，踢毽子，啊！可惜很遗憾我点开的是跳牛皮筋的科技树，后悔！,2019/7/30 23:21,46
5,无疑，这是今年暑期唯一的爆款+黑马。 哪吒和敖丙的友谊，努力过，彼此成就过，此情有憾，然无对错，往后各生欢喜。哪吒和父母之间，同行半路，一别两宽，余生漫漫，依然亲情守候。,2019/7/28 20:41,80
4,有些人一谈中国电影就扯立意扯逻辑，谈漫威的时候标准就降到爆米花电影。,2019/7/27 11:41,113
4,原版的哪吒是最道系的神话人物——不受半点委屈不着半点羁绊，宁可剃骨削肉也不违本心。其间之血腥极端背伦，同他清纯稚弱的外貌形成极致对照，在封神榜一众妖仙之中也是最cult的。当然，这种无君无父的故事现在不许拍了。然而鬼娃恰奇的脸和“我命由我不由天”的正能量并不能补足莲蓬里的窟窿。说好听是符合流行，说难听就是俗气。跟我记忆里的哪吒落差未免太大。感觉是用他的身世设定讲了个别人的故事。好在故事本身，除去个别屎尿屁掏裤裆的梗低级且不知所谓之外，整体还是流畅的。制作也非常用心。远高出了国产动画的平均线。,2019/7/29 18:44,62
5,做预告片的人可以开除了。以前看电影的时候，很激动，眼里含泪打转。这一次，我靠，眼泪流到脖子那儿了，没赶上截住。不过这片也有几段很差的，瑕不掩瑜,2019/7/14 17:36,135
4,中国动画缺的不是技术，是故事，和讲好故事的能力。在故事的完成度之余，还有一定的深度。最难能可贵的是，哪吒是个反传统的英雄，他天生反骨叛逆又肩负重任，他是不被认同的异类，在戏谑的打发愁苦之后，迎来最终的爆发，切切实实的感动。李靖也一直教育儿子哪吒，不要在意他人的眼光，要做自己想做的人，不要轻言放弃，包括在生日宴上对儿子说的一番话，一个不善言辞却一直包容理解儿子的父亲形象就油然而生了。要说教育和父子情，吊打隔壁《银河补习班》。,2019/7/18 23:12,203
4,二刷完毕，确定是我本月甚至今年的惊喜之作。妇孺皆知的“哪吒”神话传说在这里被重新解构，整体的故事完成度很高，这很难能可贵，辅以更具观赏性的喜剧元素，让整部片子的娱乐观赏性提升不少。,2019/7/20 20:27,80
4,光线点映。冷不防看第一支预告确实有点挑战审美，不过看完就会完全爱上这个古灵精怪的混世小魔王，是当下流行的丧燃款。外表邪魅狂狷烟熏妆，内心是个单纯善良的小孩，好面子装酷很可爱。饺子是学医的，一点点自学成动画导演，了不起。主创说这片并没有花很多钱，请不起一流特效公司，就找了一堆二流三流小公司磕了好几年。画面比大圣精细，前半段笑点密集，哪吒无敌破坏王状态、四个人追逐打斗长镜头很精彩，密码指纹解锁、坐骑放映机猪、山河社稷图、指点江山笔、三维弹球有很想象力。父爱、母爱、师恩、和基友敖丙亦敌亦友等人物关系也都刻画得比较充分。哪吒要拍成三部曲，明年还有姜子牙，期待上古版复联,2019/7/13 15:15,161
4,非常完美了，角色的设定和特效终于完全达到了国际水准，对情节的改编也很合理，无疑值得赞叹，强烈推荐去电影院看。但缺点也很明显，就在于这巧妙的改编本身，因为它最终完全消解了哪吒作为一名逆子英雄的强烈悲剧性，他终于还是被驯服于“伦理”了，所以这又真的是一个“哪吒”的故事吗？不，这只是一个正能量统御天地的故事。,2019/7/19 20:28,83
4,我命由人不由天，谁不会为之泪奔呢,2019/7/21 18:47,34
4,这件万龙甲啊，太沉重了。敖丙带着全体龙族的希望，义字当先就这样冲进天劫了，最后只剩一缕小烟魂。实名请求封神宇宙给我龙族一个好结局，别再虐了。个人感觉龙族副线比主线更出彩。加油啊，封神宇宙。,2019/8/7 3:51,46
5,身份认同长久以来被父权社会描述成无病呻吟的小事，不成体统的歪道；从前的哪吒们，动仄削骨还父削肉还母，投胎再造是他们逃离家庭歧视和社会指摘重获自由的唯一方法； 如果明天，我们每个人都可能是被主流价值观霸凌的没有三头六臂的哪吒；那么今天，我们还要不要作嘲笑一切“怪物”的庸人，镇压一切“妖孽”的玲珑塔呢？,2019/7/24 0:19,61
5,说烂片预订那大叔，动漫非得拍给小孩看？你不接受设定别代表大家，还有哪吒啥货色但绝不是你想的那种设定，好好多读书，再回去好好琢磨下封神。 观后:吹爆这片，今年最佳国漫。,2019/7/19 21:14,352
5,终于打破了《大圣》《白蛇》拘泥于“为国风而国风”的短板，硬件条件满足的情况下专注于塑造人物性格和“逆天改命”的全民情绪点，是近几年《封神》IP改编最满意的一次，《悟空传》请你过来看看人家是怎么拍的。另外哪吒身上看到了漩涡鸣人的影子，不知饺子导演是否也是《火影》迷呢？,2019/7/20 22:25,78
5,主创有才华，陈词滥调的神话故事也能拍的圆润饱满，有血有肉；导演没审美，再多投资，再好的题材，再大牌的明星资源，拍出来也让人皱眉，只能靠着争议性，话题性哄骗观众的钱，然后安慰自己，赚到就是成功的。万马齐喑究可哀，中国一直不缺有才华有实力有心思的创作者，缺的是机会，是社会资源的不公平分配。,2019/7/20 20:13,63
4,避重就轻间完成了从“父母皆祸害”到“历史进程靠个人奋斗”的温和改良，将哪吒原有的玉石俱焚般的刚烈变成了更符合广泛受众的取向；广泛地吸取了欧美动画长片的剧作模式和无厘头的幽默节点设置，大量的小聪明聚合体。,2019/8/10 17:21,24
5,火然，意思是要火的样子。比大圣厉害多了。冰与火。不虐(让再长大点再来虐吧，先美好童年先)，从头笑到彩蛋，踢毽子感人。丑萌喜欢。坐等好影院屏幕二刷。3D记得带上眼镜儿~火，火个小哪吒吧,2019/7/14 17:33,503
5,比白蛇缘起更成熟，国漫又进步了！！！又燃又有内核，打戏，画面，人物表情，人物性格的塑造和心理建设，都堪称完美。 “是魔是仙，我自己说了才算。”“我命由我不由天” “若命运不公，就和它斗到底!” 天生倔强，打破成见，这，就是哪吒！,2019/7/20 21:22,415
5,敖丙好帅好苏啊……我对这种类型的男二简直无法抵抗……,2019/8/2 0:45,36
4,故事讲得很出彩，实现得也很好。但有一些对白好像刻意的降低了品质感，我觉得不必要。总之加油。,2019/7/27 22:22,24
4,在重庆的影院 人们随着太乙真人的四川普通话哈哈大笑 这样就很好啦 （当然我还是更喜欢经典版本的哪吒 那才是“我不连累你”和“不认命”的真正模样 在我心里 哪吒和大圣是比哈姆雷特还伟大的悲剧形象,2019/7/27 23:54,33
4,熊孩子恐惧症患者慎入,2019/7/19 23:48,36
