rating,comment,time,votes
3,情节拖沓、画风遭诟病也便罢了，但是男主角偏执的卤勇，偏偏可怕地天真优柔，合在一起就是本末倒置、轻重不分，这令一众为他坚持战斗、因他赴死的人情何以堪。对比一下浦泽直树的少年吧，哪个才是值得人们为其赴死啊！下一季若还如此，必遭弃剧。P.S.全剧最亮点当是毫无性格的三笠配音却如此靓丽。,2013/10/2 16:37,0
3,又不是伊藤润二，满头黑线的讨厌死了/-歇斯底里，各种闹心/这世界观真是很容易让人联想点什么啊呵呵呵/不是没有好处，但也吹得太过,2014/3/14 12:37,0
3,我是制服控,2014/5/20 22:05,0
3,前两集神作。后面越来越烂俗,2014/2/2 23:01,0
3,看过三四集之后弃了，也许是好剧吧，但画的有点恐怖血腥我胆小吓着了~,2014/3/25 9:43,0
3,男主一开始超中二神烦，后来变成巨人以后好点了，就算有老爹给自己开的挂也是除了小杂兵以外什么巨人都打不过，最后一话要不是突然给了挂也打不赢亚妮。脸崩坏好多次，除了OP2以外音乐都太棒，IG和泽野弘之加分。大概是因为民工了所以虽然时髦值完全没有马猴烧酒高但莫名其妙觉得会想到小圆......,2013/9/29 21:26,0
3,硬伤太多，不要跳坑,2013/10/2 19:53,0
3,当然是一部好作品，但有时候看得没耐心，因为主角os太多了。不需要说那么多人生意义！我喜欢留白的表现手法，不那么爱日本戏剧的原因就是这种啰嗦的表达太多.....,2024/1/6 18:10,2
3,不出抓浪费cv！！,2014/2/4 12:50,0
3,看了第一季，印象最深的就是男主睁大眼睛的怪叫。抱歉了，亲爱的小伙伴们，我实在“燃”不起来。本片通过再一次诠释了“没钱靠变异”。,2014/1/11 21:43,0
3,对热血动漫真的不感冒啊,2013/12/14 20:37,0
3,http://m.douban.com/?session=abe2a51c,2014/5/6 23:22,0
3,开始确实很出彩- -但是越看越没劲，╮(╯▽╰)╭,2013/8/31 9:00,0
3,(￣_￣|||)忍不了了。。15集弃。,2013/7/21 19:37,0
3,提纯的产物：王道、查案与暴走巨大化。eva的成功在于人物少而集中，巨人众多人物个个趋向纸片，多回忆少交流，王道作品的通病，只有 放下与勇气、爱与死 是不够的，除了酝酿绝望氛围没有任何用处。动作设计真的优秀 for 今井有文,2020/4/24 20:59,3
3,看了前面几集，觉得不是我喜欢的类型,2013/6/8 0:31,0
3,这么多人追捧，我就不知道哪里好了,2013/10/4 23:51,0
3,鸡肉味儿，嘎嘣脆。,2013/11/23 1:54,0
3,稀奇古怪且非常不讨人喜欢的男主，已及完全没啥悬念的剧情。幸好动画版拯救了漫画里难看到爆炸的画风。,2020/12/27 11:08,0
3,没看完，弃了吧，对这种热血假阴暗的好像不怎么能看下去了,2014/3/19 18:49,0
3,巨人如果不是长这么喜感的话我会给四星，另外感觉剧情好拖拉有木有！各种回忆杀，一集的信息量小。（完全不明白这世界怎么了。这个这么火=  =,2013/7/5 9:04,0
3,情节拖沓，精炼点就好了 。,2013/10/10 20:56,0
3,🎵红莲の弓矢,2014/8/23 0:11,0
3,第二季绝对不会看了,2013/10/2 13:26,0
3,巨人的形象设定，无嘴唇，牙齿骨骼外露；Eren父亲给其注射药物-获得化身Titan的能力；人物角色太多内心独白. 比较喜欢的角色：Mikasa,2021/3/2 13:18,0
3,烂尾……,2014/2/17 3:33,0
3,各方推荐下，看完了，尼玛节奏好慢……好处就是人物性格倒是挺鲜明的。总是有种淡淡的自卫队YY的气息,2013/10/28 8:52,0
3,熬了几天夜 终于追完了。。。同时看了很多全面解读，啊、原来是这样呀、那就讲通了、我说巨人干嘛吃人类呢、作者建了一个小宇宙啊，真强、、到底是军国还是反战要自由，我觉得还是挺军国的。毕竟正面人物用了侵华战犯的形象是事实。。另外就是太拖沓了，25集就讲了那么一点点事儿，文字三言两语就搞定了啊。本来就不是银魂那种日常吐槽番，什么战斗啊自由啊啥啥的，我难以热血了。总觉得很军国。。阿尔敏还不错。,2020/1/2 7:45,1
3,其实是有点恶心，然后看完剧透我就没得欲望再看下去了，好无聊的情节，人变巨人，没得新意，而且不喜欢男主，一点都不喜欢！,2014/3/2 2:01,0
3,★★★☆,2013/9/29 15:31,0
3,重看。3.5。第一集艾伦叔叔对他说：你欠缺的是力量，而我缺少的是勇气。随后围绕着短暂的主角成长线展开了各人力量的“习得”之旅，以及仿佛只有生离死别一刹那才能成功激发的勇气重拾过程。好像只有两者兼备才能拥有尊严一样，又似乎只有在特定环境下这两者的凸显才值得被众人肯定一般。就在这种丛林法则的驱动下，人类对抗劲敌时变的越来越强大，但也越来越与眼中十恶不赦的劲敌无甚区别。如果之后几季能把变成巨人却大喊着“我要干掉巨人”的艾伦的正面形象反写到极致深入自省，不仅能掰正被唤醒的社达倾向，有趣度应该也会数以倍增。,2021/2/17 22:46,1
3,真心是凑热闹看的~ “世界是残酷的”…… 结局伏笔太多 这是要出续集的节奏吗？,2013/10/12 1:55,0
3,真是高开低走的典范。第一话燃到不行，后来的剧情越拖越慢，节奏越来越缓，支撑的燃点不够，卖点不新，深度乏乏。开篇豆瓣9.4分，现在8.8，第一话我给五星，现在三颗拿走吧，拜拜不送。,2013/10/3 22:47,0
3,评价挺高的，不过个人觉得一般……特别是OP，算是复古咩？好难听……,2013/11/10 18:30,0
3,看的我真的挺闹心的 不知道为什么这么火 最近好像又说这作者辱华 巨人就是中国人？唉,2014/2/10 19:44,0
3,对于便当太快的我通常都没有什么好感（其实主要是捧的人太多，落差难免大）,2013/9/29 14:06,0
3,脸谱化还是蛮严重的，过了中二的年龄再看兵长这样的酷盖就会有点觉得脑残。不过这部剧里调查兵团不留余地的牺牲小众为了大众的方式倒是暂时有点意思。,2019/11/12 18:01,2
3,默默觉得其实也没啥神的。。。,2013/12/29 18:53,0
3,实在不是我的菜,2014/6/8 10:44,0
3,拖……,2013/9/6 3:34,0
3,这动画片里穿帮的地方真心不少啊～～～袖标一会儿一个样。。。。。。,2013/5/16 18:04,0
3,是我的品味跟不上了么。。。一般性,2013/12/31 23:24,0
3,看过但不下去,2013/11/17 12:57,0
3,@人类衰退之后       好不喜欢男主啊！这画风，冤罪即视感！,2013/5/1 0:15,0
3,好莱坞快把电影版权买了吧,2013/6/24 2:53,0
3,大概是自己的水平有限吧，对于这种大热的anime真是欣赏不来。巨人对人类的杀戮，人类对巨人的杀戮，以杀人为前提的剧不管多燃都是负能量。,2013/7/9 0:11,0
3,不跟风 就这样吧,2014/5/2 9:13,0
3,第一集挺震撼的,2015/3/13 21:48,0
3,一集弃,2013/12/20 19:55,0
3,说真的，进度实在是太拖拉了。。。几外镜头能交代的情节要拖一整集。。。然后，剧情的话，我也没能理解这么高分的原因，是因为三笠的8块腹肌么。。。我只能说是谏山创或别的谁行大运了吧。。。。。。。。,2013/7/1 12:57,0
3,制作精良，悬念不断，一些细节幼稚过火，逻辑也有问题，节奏也很拖，不过还是经常能燃得起来，总比海贼火影什么的强多了,2013/9/14 21:31,0
3,对主角的性格非常不喜欢，不知道为什么就这么火，所以扣点分。,2013/9/29 22:33,0
3,7集弃。。。,2014/2/24 15:35,0
3,优？画技？节奏？音效？no no no，作为个战争控，我只看到这坑爹的守城……中国人1000年前都能做的比这个好行不行？你这军队其实就是穿的美美的给人家当口粮的吧？护城河在哪？哨兵炮兵工兵射手弩兵在哪？墙这么高却这么薄？多兵种配合作战在哪？毛病多的没法数过来！百年专业坑爹啊是！,2013/10/7 15:21,0
3,吐槽无力 换个主角吧 兵长是真爱啊,2013/9/25 17:58,0
3,不明白为什么会那么火，挺一般的，还有，男主真的是个八嘎,2014/1/16 14:44,0
3,六一童鞋推贱的！目前看来设定挺新奇的，可是男主的性格喜欢不起来啊，渡过少女时期之后就对这类冲动型热血少年无感了！,2019/8/20 12:55,1
3,不高兴看,2014/3/6 20:03,0
3,OS略多...160死鱼眼V5 整体剧情人设其实有点..中二啊。,2013/10/6 7:38,0
3,bgm赞  剧情略、、、,2013/10/4 22:30,0
3,血腥到我都觉得过了，忍着看完了。难道是我老了？,2013/12/13 21:22,0
3,国内漫画男主一个人强，日本漫画男主一个人怂。哎，均衡点行不行。,2018/1/29 12:09,0
3,好像还是漫画好点,2024/3/9 12:27,0
3,看了电影版 反而忍不住要来看动画原版了。居然在一个叫嘀哩嘀哩的網站找到了 是哔哩哔哩的姐妹网吗 哈哈哈哈哈哈。25集 每集最多25分鐘 但卻花了三天才看完 並不是我看得慢 而是因為看得很認真。雖然對動漫真的不感冒 但還是被短評裡的那句「感覺好像在看奧特曼啊～」笑瘋了。,2015/8/22 23:17,0
3,不好看，男主傻缺,2014/8/28 16:22,3
3,反正我就觉得一般 - -,2013/9/15 12:48,0
3,转去周刊可拍民工。,2014/11/25 22:39,1
3,题材新，不明白为何突然就成了神作。。。。另外就是动画太特么拖了,2013/9/29 11:16,0
3,这个我感觉好像就那样,2014/5/8 11:44,1
3,画风确实比漫画好太多！但是剧情太神了....有点接受不能....,2013/6/25 10:22,0
3,动画有点乱，漫画更好些,2014/4/8 15:53,0
3,节奏好慢,2013/9/6 19:34,1
3,"初中看的，当时很喜欢兵长
20240526二刷，塔塔开！塔塔开！
不过我确实不太喜欢太多打斗和血腥的片子",2022/5/3 2:15,0
3,磨叽死了,2014/3/8 13:14,0
3,它只用了4集就把火影前400集讲完了。。。BGM太加分！不过说回来，这种“岛国根性”的恐惧、屈辱和危机感，本身就是日本人的心理写照,2013/7/22 20:43,0
3,热不起来,2013/7/18 0:10,0
3,男神爱看的,2014/2/2 14:07,0
3,看剧动机不纯，无法评价（虽然其实不是很喜欢）,2020/9/21 1:42,0
3,没看完，越看越不知道作者想干嘛,2014/4/27 7:04,1
3,世界观设定很宏大，但是相应的也缺少了日漫特有的日式幽默，整体太沉重。节奏快大打斗比较多，对我来说有点太吵了。以及不太喜欢里面的女性角色设定，恋爱脑女斗士三笠，病娇阿妮，科学疯子安吉,2021/2/7 20:50,1
3,主角真心爱不起来,2014/3/4 1:40,0
3,画质精美 但是还是看漫画吧 动画太拖了 撑不起故事宏达的背景,2014/1/11 14:59,0
3,主角的性格忒墨迹,2013/9/29 9:24,0
3,巨人画得好丑,2013/12/5 0:45,0
3,对我来说就是还行，有往下看下去的欲望，但也并没有感受到震撼，期望值太高,2022/12/22 6:11,0
3,背景作画精良加一分，细节崩得可笑减一分,2013/10/4 2:13,0
3,看到后面剧情越来越变扭 作者试图回避【侵虐者是否应该付出代价】这个问题 最后主角选择了类似以色列对待巴沙的方式 因为我也被威胁过所以那就直接消除所有威胁自身安全的问题吧（杀光世界人）,2020/10/16 14:23,0
3,一般啊,2013/7/29 16:21,0
3,觉得大概是中央政府培育出来的巨人这样可以把臣民像家畜一样圈养一劳永逸、需要控制人口的时候放几个进来就好。第一季完结可以给评了。题材新颖，人设还行，节奏紧凑；无数次吐槽为什么不能努力造个飞机、明明已经有喷气式立体机动装置的技术了……人物动不动就大吼大叫情绪崩溃这点让我很爱不起来。,2013/7/14 12:01,0
3,越看越无聊 剧情拖沓,2013/8/27 5:17,0
3,行行好别出二期了让巨人厨消停会,2013/9/29 21:23,0
3,看到26集，动作场面还不错，其他的真是渣，智商为负！！！！,2013/12/4 22:01,0
3,就那样吧，反正我是弃了,2013/6/5 17:04,0
3,其实中途弃了 还在追漫画 有点太火了 就不喜欢了,2013/12/27 21:49,0
3,我是有漫画绝对不看动画的人，这是第一个逼得我看动画的片子……漫画画工太差……我看了好久都分不清谁对谁……主角圣父的有点过……,2014/6/1 9:58,0
3,画风。。大局把握上面总觉得有纰漏。希望不要画到作者入土为止,2013/9/29 22:33,0
3,刷得太厉害受了传染。看过发现一般，大概是鸡血打过了的感觉。我萌三爷好厉害…,2013/9/30 22:31,0
3,刚开始觉得画面和配乐很用心，但看到第10集忍不住想吐糟，剧情好拖沓！人物内心OS神多，那些无知懦弱的人类神烦，一集不到25分钟有一半都被片头片尾剧情回顾各种蠢货喊着「啊啊啊～」地占掉了时间。能不能别在明明只有一秒反应的情况下还又哭又回忆又震惊好几分钟啊！好捉急！,2013/7/25 0:35,0
3,前几集还好，后面的每集都有很多废话回想什么的。拖拉,2013/10/25 19:07,0
3,怎么说呢……这个就是神一般的背景设置和华丽画风配上了火影忍者一般的拖沓剧情和直接心理描述……,2013/9/11 0:27,1
3,本来剧情可以有更深层次的发展，但停留在口头上的自由和仇恨太多了,2013/12/29 11:57,0
3,制作满分。可是再精良世界观也不是菜，整个日本侵略中国前期的心态，什么我们一直被压迫啊什么我们一直被囚禁啊，都是典型岛国危机感的超直接二次元化，追不下去。,2013/5/3 0:34,0
3,渣猪脚真让人捉急,2013/4/29 14:49,0
3,世界观到处抄,2013/12/6 8:28,0
3,第一季追寻着巨人的脚步，在探索。与其说是铺垫，不如说后面的变异更厉害,2024/11/11 22:54,0
3,男主不讨喜，兵长才是最爱好吗,2017/3/27 18:05,1
3,前八集很赞，但最近三集转折生硬，情节拖沓，剧中所有人物智商急剧下降，感觉在拖剧情。准备弃剧,2013/6/28 19:52,0
3,挺好看的。对于一个剧情爱好者来说，一摞摞悬而未决的谜团就是最热血的元素啊，何况分镜凌厉，设定带蒸汽朋克风，画面又符合我对动漫的审美要求。可以打四星的，只是对真正值得四星的作品不公平，三星半吧。,2013/10/2 1:10,0
3,拖拖拉拉的第一季终于结束了 片曲尾赞 韩吉萌 从里维尔转埃尔文,2013/9/29 22:23,0
3,火得莫名。。。看B站吐槽真的是这部剧的最大乐趣,2014/2/12 21:13,1
3,第一季大约就是介绍下世界观设定，做为一个系列开端不算优秀,2021/3/1 13:01,0
3,不喜欢男主,2013/11/24 11:42,0
3,挺好看的 就是画风太恐怖了，里面人时不时的吓我一哆嗦，然后呢画工也是硬伤，很多时候分不清让和艾伦,2013/12/3 9:48,0
3,过誉了。脑洞很大漏洞也不少，所谓深度讲得过于直白，最烦的是内心独白喋喋不休。,2021/9/7 20:55,8
3,OP好燃！！！相比猎人里时常出来调皮的BGM，巨人里的BGM真的算良心了！漫画看起来其实更带感，但是画面太渣，动画弥补了一点点，即便如此，还是漫画里的三爷更飒爽，我到现在还没适应唇膏版的三爷Orz,2013/6/14 23:08,0
3,好大一个坑啊！看完了还是没有解密好难受啊~虽然很红，制作组也良心，战斗画面超爽快，但整个故事的背景设定不喜欢，太虐，典型的岛国心态。,2013/10/8 9:30,0
3,男主就一马景涛！吵死了！……真不懂哪里好看了,2013/7/28 19:16,0
3,第五集燃到爆燃到爆眼淚都要飆出來了，然後，就沒有然後了,2013/11/10 0:27,0
3,弃,2013/9/19 18:12,0
3,比漫画那难看死的画提升了很多，动作场面是亮点，很好的表现了原作氛围，和漫画一样，在人可以变巨人的剧情出来后，感觉没有之前人类一直被虐的时候好看,2013/12/31 0:30,0
3,被人形EVA被吃人吓哭了QWQ 比真人版吃人恐怖多了,2013/5/2 13:48,0
2,看到男主鬼叫鬼叫就烦。。难道是我老了吗对于这种夸张的表情完全接收不能，2集弃。,2013/6/1 3:34,683
1,俗不可耐，怎就被碰到天上去了，毫无深度可言,2013/6/20 19:01,192
2,斯达夫太黑都不知道黑谁……能做成这样给跪了。magi遥相望呵呵【,2013/4/8 10:50,64
1,裸奔的巨人,2013/6/20 6:50,108
1,优秀的画质，渣渣剧情，在看到渣渣主角复活的时候狗的血都喷光了，抗日神剧？,2013/6/8 17:42,65
1,我果然不适合少年动画啊……,2013/5/19 0:01,48
1,12集.烂爆,2013/6/23 12:26,45
2,任何设定都很老套，主角个性、故事情节都不足够吸引人。名字再特别也没用,2013/6/8 13:24,54
2,一部已经放弃的动漫,2013/9/21 18:08,22
2,难道我老了吗，那种夸张的表情和音效我已经接受无能。还是喜欢黑之契约者和无头骑士之类的内涵片。,2013/5/14 15:59,61
1,对于这种一开始三观就不正的动漫我只能说我除了反感就是反感。最近的日本动漫真的是越来越重口和带有强烈的个人主义了。而且动漫的主要角色普遍都是默默地屌爆了。我很反感这部动漫。我觉得这简直就是一种莫名其妙的大吼两句然后它就成真理了。。。真是既痛苦又滑稽。。。,2013/11/23 12:38,27
2,11弃，不追了再见。炒作一个热点真比尽心竭力做作品好卖太多了。话说回来，比起动画不是改编游戏更有意思么。,2013/7/19 13:36,15
1,视听污染，精神墙监，尤其是OP和巨人，牛逼吹破不过是糟心版少年热血套路罢了，主角靠着报仇二字活到今天也算是个奇迹,2016/3/24 13:11,19
2,一个同学特别喜欢，就连输入法皮肤都是这个。真不知道这种身材奇丑还吃人的血腥动漫有什么好的,2017/2/28 23:31,14
1,富野光头：“用漫画来表现如此作呕的世界是我绝对无法认同的地方，而能接受这种漫画的这个时代也非常的过分”,2017/6/19 17:28,11
2,看到十几集的时候彻底放弃。这么好的题材没给美国人英国人拍真是太浪费啊！一个个除了中二就找不到词来形容的主角还想撑起这么宏大的史诗级战斗？还好意思没完没了的回忆片段拖剧情？看看指环王再看看权利的游戏，真让人呵呵,2014/5/9 3:22,13
1,这个在二次元化路上光速前进的世界已经不是我想了解就能理解的了。。这个故事对我来说从一开始就“不成立”且荒谬的没有吸引力。。,2013/6/17 2:15,34
2,Mikasa的CV不错，挺燃的,2017/1/5 14:39,8
2,老了，欣赏不能。,2013/8/20 9:56,11
2,呃……大概是我太享受不了这种动画了，会不会有点儿矫情，虚假？,2013/11/18 21:26,19
1,100年过去了还对巨人一无所知一点战术技巧都没有的硬碰硬，你是调查兵团不是作战兵团难道收集各种敌方信息不才是最重要的吗？明知巨人昼出夜伏就不能晚上出去调查啊！在神作匮乏的年代如此烂片都能上神坛现在的孩子真可怜。ps：每集都有人大喊大叫痛哭流涕十有八九还都是男的！这是韩剧还是琼瑶戏啊！,2014/1/21 9:38,9
1,很久没有看更新。在得知富野由悠纪老爷子的评论后果断彻底弃掉,2013/12/3 11:41,4
2,"看完第二季回来评论第一季, 不得不说第一次看时看到前几集男主无脑中二时选择弃剧, 还是挺正确的",2021/4/8 17:35,7
2,前三集后五集总算不是一个画面对话到底，但是剧情上来讲真不知道有什么可以期待，无限的对话和解释，无限的拖沓，节奏还是太慢了。,2019/1/5 17:41,4
2,看到第九话 就让我没有想看下去的感觉了……,2013/6/2 19:22,23
1,画工好烂啊.........,2013/7/15 7:31,25
1,弃掉。被泛滥又无意义到无法忍受的内心独白、精神训话折磨得死去活来，导演对勾画临阵胆怯手脚发软大脑空白的人痴迷到了病态的地步，动不动就胆怯啊犹豫啊犹豫啊胆怯到呆若木鸡，13集以后每集三分之二的时间是胆怯的内心独白，反感到无以复加，果断弃,2013/7/31 8:33,5
1,"节奏太慢！！！
搬石头一个月！！！
女巨人跑一个月！！！
弃！！！",2013/9/29 21:50,8
2,一集 画风弃,2013/11/16 18:19,5
2,一集弃,2013/11/23 2:20,4
2,动画的质量确实算不错 但人设故事接受不能,2014/9/20 23:51,4
2,这是给低龄化人群看的吧，内心戏要不要那么多，生怕看不懂需要反反复复的说吗？这部剧真的是从开始到放弃。,2019/9/14 20:16,12
2,"【弃剧】设定很离谱啊……为什么是“巨人”？凭什么是“巨人”？为什么所谓的巨人不穿衣服？为什么是“吃”这么恶心的动作？为什么没有语言？为什么有时候动作慢有时候动作快？为什么那么丑！？
反派全都非常脸谱化，一个比一个贱，看着真气人，无语=_=，看动漫，是来受气吗？角色的愚蠢和咆哮无时无刻不让我感到难受。
第7集，反正除了男女主其他人都是怂比呗，只想着回墙里面，只有男女主有“伟大理想”。女主一顿嘴炮，怂比们也都跟着燃起来了，然后到了前线，马上又变回怂比，这到底是在做什么啊？无聊死了，哪里好看？
“就因为这样受人施舍，所以才战胜不了巨人啊。”
……我没懂是什么原理
人物塑造一塌糊涂",2023/8/20 13:02,3
1,智商负值的日本人在那里表演打架，一个巨型智障把他们都吃了的故事。,2023/11/9 23:59,3
2,重看第一季，把原先的满分给改了。最初看到第一集巨人入侵、艾伦妈妈被吃掉的剧情所带给我的震撼已经荡然无存了。我只能说漫画结局让前面的许多情感和剧情都成了笑话。辛苦分打给动画制作组。,2020/12/10 15:44,3
2,我一点都不想看内心戏啊魂淡！多来点热血的打斗好嘛！弃了！,2013/9/19 21:30,9
2,"弃,男主太傻逼而且还死不了.",2013/6/3 1:14,3
1,真不知道这么垃圾的片子怎么会这么高的评分,2020/2/12 14:56,5
1,除了巨人设定，其他不要太雷人。。。,2013/5/14 9:08,28
2,就是看个世界观，实在接受不了番剧中二的气氛和拖沓的节奏。看起来很左啊为什么后边会变成那样呢,2021/4/28 0:18,1
2,你在说什么胡话啊。,2013/9/30 12:20,1
1,觉得阿尼好可怜,2013/10/14 23:13,0
2,不知道为什么人气那么高  觉得不好看  一点也不热血  剧情很弱  表情也太夸张  最重要的一点  我很讨厌艾伦！！！！！就兵长还可以 挺有魅力的！8.8分太高了  照我看也就7.5左右！,2013/12/29 23:15,0
1,太爛了！這真是我看過最爛的漫畫之一了，雖然剛開始時，這漫畫還是不錯，只可惜作者越畫越爛，把整個故事給毀了，我不得不給差評！,2014/2/1 10:12,2
2,3集，果断弃！,2013/12/5 20:46,0
2,满满都是恶意。作者有脑，就是心太窄了。,2013/12/14 20:44,4
2,一星给脑洞，一星给主题曲。没这么讨厌主角过，实在看不下去了。,2021/4/20 9:06,2
1,看了一二集觉得满是被害妄想，于是就弃了。觉得这样的故事，尤其泥轰人来说意味特别恶。日本国民洗脑用。意识形态严重，各种被害妄想。给我朝孩子洗脑的话偶会比较同意，但日本就不行。,2015/12/16 13:09,2
2,精彩的战斗场面和泽野大神的BGM也没能拯救动画拖沓啰嗦的步调，11集弃番。【官方黄纳无疑。,2013/8/11 16:47,0
2,真亏我坚持了12话………………,2013/10/12 16:10,1
2,主角低端中二，忍受不到第三集，弃之,2013/8/11 22:44,14
1,要剧情没剧情，打斗也就那样。,2023/11/13 11:39,2
2,冲着主题曲去看的 前面还行 后段拖得不忍直视 题材还可以但是世界观奇葩 可惜作者功力不足撑不起来 最后 脑残小学生巨人厨真是恶心死了,2013/8/18 19:56,0
2,"那个没皮的巨人是BOSS？
用盒子看完的，后面越来越扯",2014/2/11 20:54,0
2,血腥了,2013/12/29 17:16,0
1,除了制作确实精良，有很好看吗。这个世界缺的不是狂躁。是温柔、温暖。越到后面越觉得是给军国主义洗白，妈的,2013/8/6 20:44,1
1,进击的脑残粉,2013/12/1 18:04,7
1,看了一集1星给定，20多分钟不想智力受辱所以快进了8次。整作的世界观，科技和文明完全没有同步搭载，中世纪硬加后现代的湖绿比当年无限恐怖流还无聊。山寨TheMass的作战曲，模仿蜘蛛侠一样的丛林打斗，冗长啰嗦的对白，最后的巨人就是从辛巴达航海记连环画里直接克隆出来的，民工漫的末日,2014/1/12 21:10,4
1,。,2013/7/13 4:33,3
1,巨人厨尤其是兵长厨真是烦的要死 本来制作很精良的动画 但是粉丝总去别的作品刷巨人刷兵长刷一米六刷你麻痹 我就是不满意你们！,2013/8/18 15:21,2
2,看了半天完全没有感觉很好看，日本动漫喜欢回忆的傻叉习惯更是继承的非常棒,2013/9/12 16:07,0
2,嘎然而止,2014/5/11 14:09,0
2,就很无语了就终结了，而且没有海贼和火影好看。2星,2013/10/21 15:23,0
1,巨人不能去摧毁了那地下室?,2013/10/6 15:20,0
2,莫名其妙你燃个什么劲，果断弃,2013/8/8 3:40,0
2,老实说女生不适合看这类动画片，吓得不轻。。。不过当兵长出来就开始好看了，太喜欢这个死矮子了。我感觉第二季，研究人类变巨人的药水啥的是为了夺回政权？不然能跟人类有什么深仇大恨要变巨人造成杀戮这么恐怖,2013/11/19 12:20,0
