rating,comment,time,votes
3,制作的画风还精细，但是配音加上剧情添改不是太能接受。剧情设定还是危机加上阴谋论加上翻新而已，巨人攻击的时候总是有一种日本被核弹炸被美军日的出戏感。当然对比那个杰克与豌豆的故事还是有深度的。男主带有一个犬系女友像条狗一样的设定有些老了吧3993巨大化能力?自卑犹豫懦弱的人不可能有高谋略,2013/6/24 1:16,0
3,有那么好？,2013/5/25 12:04,0
3,后面剧情太拖,2013/7/5 11:54,0
3,那些白痴巨人不错。,2013/9/29 22:50,0
3,蜀中无大将,2013/10/2 11:37,0
3,我想说主题真的接受不了，但是还是津津有味的看到了最后。,2013/10/10 23:01,0
3,"剧情和原声够燃,可不要动不动就给我总结出一个""原来这个世界这么残酷""的结论.",2013/10/10 23:33,0
3,跟疯狗捧上天~你们真觉得好看？三星既客观又公正,2013/10/6 10:53,0
3,越来越对日漫动辄声嘶力竭大喊大叫的配音感到厌倦。,2019/8/4 16:33,5
3,巨人与其说是一部以猎奇的噱头来吸引观众，不如说以瑰奇的残酷定理和绝望感留住了观众。,2017/5/10 9:14,3
3,以为是个众志成城励志片 可是男主翻身成巨人的时候 我就知道 弱小再团结 始终赢不了...这不是作弊吗亲！！！那个超级大巨人 没有皮的那个 我猜是男主把拔...猜错了 但是 没有结局这不是坑爹呢嘛！,2013/12/12 6:24,0
3,为了神谷的利威尔而看、全3🌟全部给神谷的利威尔、巨人本身的剧情Emmm只能说是不怎么符合我的口味、加上画风、加速看完的,2022/12/11 16:38,0
3,战斗画面很良心，音乐也不错，虽然曲风不对我的胃口，剧情上血腥暴力（呵呵）又描写人性阴暗（呵呵呵）还能刷时髦值（呵呵呵呵），所以说为了黑巨人而黑巨人真心没必要，想表现自己高贵冷艳的右上角点一下就OK了，至于咱个人的评价嘛，那我还是右上角吧。。。。,2013/9/29 14:12,0
3,拖尼玛拖.,2013/9/29 12:24,0
3,完全。。不是。。我的。。热血点 。。。,2013/12/2 0:38,0
3,到目前为止，所有被大书特书的决意与牺牲都因缺乏人性而显得薄弱与可笑。唯有讓和利维两人与众不同，一个对荒唐的事态永远保有正确的疑问，一个从不盲信、一身冷静应时而动。（所以第二部分壁外搜查有可看之处）但结局毕竟未知，最终会保持现状淹没于鸡血与无脑的冲动之中，还是转向冷彻的眼光呢。,2013/10/6 23:35,1
3,哈哈哈，这是我看到最搞的评论———难道不是讲的本地B拼命阻止外来务工人员住进一环二环三环的故事吗？,2013/9/30 20:04,0
3,我真的很不喜欢拖剧情和乱煽情的部分，每次的前情提要也太长了，过分细腻的各种感情戏独白看多了真心无感，OST还算不错但是在这片子里就会给我煽情过度的感觉，总之整个片子给我的感觉就是“过了”，还是倾向于漫画明快的节奏。,2013/10/3 21:40,0
3,对此表示无爱····,2013/12/27 23:20,0
3,好看在哪？,2013/9/18 23:37,0
3,这片故事方面和钢炼很像，值得称道的是打斗场面,2013/11/12 21:50,0
3,走心看的很燃，但不走心的偏多。。。,2013/10/14 22:47,0
3,节奏太慢了太慢了,2013/9/29 17:13,0
3,热血,2014/3/12 17:15,0
3,提前知晓,2013/9/19 20:10,0
3,哪有那么好看，13。5集简直是扯淡,2013/7/16 21:24,1
3,其实我想说....从第一集开始就想劈死男主了吗....   动画师真的做的比漫画好一个格,2013/10/24 16:42,1
3,故事讲得真叫一个烂,2013/9/15 22:27,1
3,一个作品具有极端的争议说明了一种强势。不管它是否会沦为火影死神一类的民工漫或者能否成为十年后仍被人提及的神作，现在还看不出来，所以要继续看下去。但是！基本没有逃出热血漫升级打BOSS这个宿命，所以也就这样吧。,2013/10/1 16:53,0
3,看到后面就渐渐懒得看了，然后自然的弃掉了。这样。,2013/10/24 13:22,0
3,第一集就会吓cry啊，没点心理准备还真是不好办，最近日漫都开始走深刻思考人类的终极奥义路线了，即便没有外敌入侵人类也会代谢消亡的吧，其实没必要现在就开始吓唬人，不过也真是没啥新创意了，这种可以引人发省的作品才会被追捧，就是太沉重了，能不能不要那么惨,2013/9/3 5:23,0
3,终于完结了。脑残粉的热情太可怕,2013/9/29 12:36,2
3,吼的老子发毛，只想变成巨人把你们全部都干掉,2013/11/1 22:07,0
3,虽然有沦为民工漫的趋势，但其火爆是无法否认的，动画质量也非常高，就是拖戏比较严重，大概是因为漫画进度也比较慢吧,2014/2/19 22:13,1
3,看完之后四星改三星，多一星给三笠。男主的咆哮作风实在让人厌恶，太血腥了。,2014/1/3 13:05,0
3,"剧情流，这部动画就靠原作和配乐撑着了。细节相当粗糙，花了大工夫的回忆杀和内心独白完全没有实感，既不感人也不深刻。很多明明可以做得很有效果的剧情，比如艾伦对信任队友还是相信自己判断的选择，比如让让子由一心想进宪兵团到后来的改变——就这么放过去了啊！总之，entertaining, 但不inspiring",2013/11/1 13:39,0
3,刚看巨人觉得是威力加强版的丧尸剧 后来看到男主会尼玛变身了我才知道这合着是奥特曼,2013/9/29 19:50,1
3,發生地是德國嗎？男主角的姓是Jäger?這兩個設置還蠻有意思的。音樂很大氣。時好時壞的趕腳,2013/10/9 7:33,0
3,弃了。,2013/11/9 23:54,0
3,没有诚意的动画片,2013/10/11 22:40,0
3,一般啊，那个地方比其他动漫出彩了？这也算有内涵，小学生们是没看过片吧？在你们形成健全的自我意识之前，珍惜这轻易就能被震撼的感觉吧,2013/9/29 18:41,0
3,作者塑造的爱尔敏成功刷新了我对废柴认知的下限，似乎不塑造这么个角色就没法体现猪脚的牛逼。男主变巨人了？这个嘴上逞强实际明显能力不足智商下线的货唯一实现自身价值的方式么？呵呵~~~话说人类在死亡面前可是什么都做的出来的，那会像片子里那么坐以待毙，整个城的人逃亡时还会畏与权贵？13集弃,2016/2/9 1:48,0
3,一般吧，头几集没有看出来神作的气质,2013/9/23 0:11,0
3,跟风看的，10来集 弃。,2013/12/15 22:39,0
3,巨人の通灵之术！追了一半实在是没兴趣了,2013/9/9 0:59,0
3,男主实在是…减分,2014/1/9 22:48,0
3,有点意思，不过节奏太慢懒得看了。,2013/6/9 23:53,0
3,只能算是合格作吧，不明白为什么这么火。我是真不爱泽野这次的配乐,2013/5/25 17:36,0
3,原谅我看不下去 看到10几集的样子吧 没兴趣看了,2013/11/27 21:56,0
3,中二燃！不能倍速有点烦,2021/2/16 13:41,1
3,驾驶个巨人 - -,2013/5/27 21:57,0
3,"动用了非常大的意志力，才没在看完第一季的凌晨点开第二季，真的好吸引人！情感戏忒无聊……理解人物需要成长，但鉴于人类处于随时灭绝的境地，角色们情感和理念的起点也太低了！进步也太慢了！占的时长也太多了！

不知道是不是看了太多邱礼涛，二维的血腥也忒干瘪了，血溅在人脸上，还是溅在二维动画角色的脸上，观感完全不一样。虽然血液弥漫着蒸汽，但完全感受不到热度。整部动画，也感受不到疼痛、疲惫等任何人类生理性的感受。

立体装置太偷懒，森林移动感觉大家都有查克拉。大量分镜偷懒，是经费不够吗？隐约在某些建筑和群体移动时看到了三维操作。",2021/1/8 11:33,2
3,瞪大眼！,2013/9/28 0:18,0
3,感觉过了新鲜劲头就觉得这个相当之冗长乏味了,2013/9/29 11:09,0
3,画风一般，情节一般，确实一般。,2013/8/27 0:59,0
3,只有我一个人没看出好看在哪儿么？！除了泽野的原声真的很棒，剧情方面平平啊,2013/7/1 10:14,0
3,最喜欢阿明，但是运用到智力的部分太少了吧，尤其是老爱以热血煽情回忆杀来拖剧情，骗小学生啊。兵长团长也不错。总的来讲太拖了，拖得歧视人类智商那种。,2013/12/25 8:50,0
3,无感。,2013/8/9 10:12,0
3,最后几集挺好看的，但剧情上的bug多到让人不忍直视,2013/11/18 3:11,0
3,很好看啊。一口气看了九集。一共几集？,2013/6/5 1:37,0
3,短短26集里仍然充斥着让人胃酸翻滚的“回忆”情节，日本人为什么总是搞这么多伪人文场面来拖戏呢？节奏快一点能死么？,2014/5/17 8:13,0
3,杀猪叫的卫浴柜，垃圾的成本控制，上映的前的噱头，造就了傻逼拖戏的巨人，傻逼兼用卡巨人，傻逼回忆杀巨人，傻逼静帧巨人。再加上傻逼的脑残粉们，你们也就会刷刷腹肌和一米六了。,2013/10/2 21:02,0
3,奇异种这种东西作者都能想的出来一定是个可爱的人。,2014/2/23 23:52,0
3,又是一个巨大的坑，画面华丽，节奏有点慢。,2014/4/24 23:20,0
3,精品！上来还蛮新颖的，越往后越俗套，尤其是堵城墙，暴走咬人什么的，但其中有些内涵世界观还是蛮不错的。总体来说，这部剧适合16到20的童鞋看，我们再看的话，也真的是....,2013/9/30 19:52,0
3,血腥场面还不错,2013/10/5 9:36,0
3,片頭曲不錯，學會唱了，嚶嚶嚶,2014/5/15 22:09,0
3,他们还那样：小孩是主角，大人像是不存在，主角被各种扭曲，男女孩各种莫名的对白，人类悲惨的状况等等。本来想放弃，但第九集有了个较大的转折，主角自行折断左手会变巨人（看，是折断自己的手啊，多变态），我姑且看看之后会说啥。。。。看了后面的，太重复，太慢，昏昏入睡,2013/6/15 10:34,0
3,没看完啊！！！！！！！！！,2014/1/14 20:52,0
3,我看到了一个大喊大叫的扭捏男。,2013/10/19 14:48,0
3,看了一半就弃了改看漫画然后也弃了……,2013/10/19 0:01,0
3,6.5分，刚开始还好，看着看着觉得莫名其妙了，弃,2013/8/1 18:10,0
3,回忆杀伤不起啊。。。为了三笠我还是一集一集地追下去了,2013/10/1 0:13,0
3,三星半，對結局有期待，如果是悲劇收場，我願意改成四星。,2014/2/3 21:27,0
3,ppt一样的动画和粗糙的故事，时间线跨度长和故事错综复杂但是很幼稚,2024/7/25 21:59,1
3,看到ep14，有點不想跟了。,2013/7/22 22:43,0
3,有点啰嗦。,2014/11/15 11:03,0
3,15集弃,2013/9/14 18:40,0
3,还行吧,2020/5/31 11:04,0
3,这种类型的动画就要燃和萌！两者都没有就只能腐……,2013/9/19 17:15,0
3,明明十二话就能讲明白的，观众真心没那么傻啦。咱手上唯一能开挂的就是个蛋黄包，让我怎么能不往巨人党里站啊真是的。圣母心专业户咔叽先生什么时候能接一个我喜欢的角色呢，我很期待。,2013/9/29 12:44,0
3,我一个人都没有分清。看看粉就觉得too中二to了解这个作品,2014/1/14 21:23,0
3,前五集還蠻好看的。,2013/7/19 17:18,0
3,兵长无感，但设定不错，期待第二部,2014/1/30 23:34,0
3,兵长有爱,2013/12/30 17:36,0
3,局不小，中二设定不喜，肯定要出的第二季是不打算看了,2013/9/30 17:27,0
3,节奏拖沓用力过度，看的很累,2013/10/8 0:58,0
3,对男主的反应之强烈感到无语,2013/8/14 3:15,0
3,巨人厨神烦，刷兵长的一辈子都只用得起小黄瓜，还是腌过的！！！,2013/12/31 18:00,0
3,拖沓得真严重,2013/10/13 14:25,0
3,进击的巨人，超慢的速度,2013/8/6 11:17,0
3,果然看不了动漫??? 我已经努力地去接受了...,2017/8/4 13:54,1
3,原著画工烂但是分镜屌，动画崩坏出翔，三爷的脸都要被玩儿坏了吧。一头一尾不错，中间的节奏真是坑爹。音乐可以打满分。,2013/9/23 0:16,0
3,1我想巨人没有jj的原因是因为不好画吧 2 allen变巨人物质不守恒啊 3不得不说巨人这身材和美逼一模一样,2013/10/20 4:21,0
3,开播时后9分多，真心高了，小学生真能水。现在评分还靠谱，那么多给五星的不差我一个。,2013/9/15 11:39,0
3,巨人所有的槽点都能总结为一句话：作者吃了没啥见识的亏。编剧必须好评！真看出来是使出浑身解数在挽救了。,2023/3/3 18:19,0
3,虽说有大片的气场，但人类的天敌明明只是人类而已，隐喻不明不幸福。另外，巨人的发型都超好的，理发师只给不自己理发的巨人理发吗？,2018/7/31 3:09,0
3,盛名之下……,2014/5/10 9:37,0
3,兵长～,2014/6/6 21:36,0
3,感觉没那么好看，就有些打斗还可以。     6.5/10,2013/12/3 14:12,0
3,最近名声大噪的作品，但是除了世界观设定比较有新意和比较热血以外，情节简单而且拖沓，有不少情节甚至于脑残，真是是完全被过高评价的一部作品。,2013/11/28 1:03,0
3,看了漫画之后再也不想看动画了。弃了。【因为剧情都知道所以还算弃吗？,2013/11/3 15:51,0
3,当然有优点，可是，为什么我一点也受不了唧唧歪歪和夸张反应呢。。,2014/5/20 20:41,0
3,这部看到第十话就弃了.orz,2013/12/1 18:59,0
3,对于这种舍我其谁的救世主真的喜欢不起来,2023/12/29 2:26,0
3,一开始很燃，现在觉得好拖沓好无聊，弃,2013/7/28 12:42,0
3,第一集就bu喜欢 对里面传递的战争思想觉得抵触 看到了根本上的junguozhuyi 平民个大妈非要看着儿子为了所谓的精神追求去战斗 你也不好说热血还是哪里很怪异。漫画好像也瞄过一两眼,2019/7/10 10:41,1
3,剧情真的拖沓，给五星的真是...,2013/7/21 0:23,0
3,确实是良心番，画面华丽动作流畅，剧情紧凑人物不婆妈，除了男主爱吼叫之外没啥别的缺点。,2016/4/27 17:01,0
3,宏篇巨著 不是我喜欢的风格   努力看的后果就是累个半死,2019/10/30 21:38,1
3,进来看作者的脑洞,2022/1/24 9:15,0
3,强行深沉耽误了故事,2013/12/8 7:46,2
3,提不起兴趣,2013/7/2 12:28,0
3,我还是更喜欢大剑一点 但是进击也还是不错的 起码男主不像拉基一样那么招惹讨厌 =。= 本来是打4颗星的 看到12集 剧情拖沓实在是忍不了了 三颗星吧 ……,2013/6/17 23:55,0
3,还行吧···,2014/5/14 22:27,0
3,已经是弃的节奏了,2013/8/28 1:34,0
3,为什么要拯救人类，人类值得拯救吗？这一部到了最后似乎才刚刚开始触及这个碇源渡之问。制作是极好，燃是极燃，几个主角多少有点讨人厌（男主比碇真嗣还讨人嫌真是少见），但是末日番不回答这两个问题，很难说令人满意。,2013/10/6 21:22,0
3,看得脊背发凉·艾伦太让人着急了~,2014/2/11 23:17,0
3,也就这样,2013/9/30 18:15,0
3,新鲜感过后，也就那样……始终燃不起来……,2013/8/9 1:32,0
3,故事一般，但是动画表现力不错，打斗场面好看………………除此之外，感触不大,2014/5/28 3:14,0
3,快进着看完了=。=兵长最萌的也就是打扫时候开窗的口罩相了,2013/10/4 23:49,0
3,诚意之作吧。,2013/7/7 17:05,0
3,最后几集为了凑结局弱爆了，无论是从画质还是内容上都是高开低走。当然设定本身还是有趣的,2013/10/20 18:08,0
3,_(:з」∠)_我是看完第一集才去看的漫画，总觉得漫画虽是草稿流，但是表现力还是比动画要强得多，三笠的微妙的表情变化都有表现，而动画则一直是面瘫高冷，而对艾伦的处理显然也更加简单粗暴，让人感觉就是一个只会冲动行事没脑子的傻逼……,2013/12/3 12:57,1
3,看到26，不喜欢男主的长相和性格,2014/6/9 17:31,0
3,怎么回事我已经燃不起来了吗,2014/1/12 23:43,0
3,我努力看到第六集了。入不了戏就会觉得很脑残，人物形象也太单薄了，节奏也很奇怪，最难看的是第四集，搞什么新生训练营吃什么白薯跑什么步玩什么美丽的黑发。制作倒是挺精良的，只是这样。,2013/9/26 18:11,0
3,==其实我不太明白她为嘛辣么的红  八过兵长还是贱贱的很有爱嗒,2014/1/8 9:18,0
3,好看，但我很讨厌这种极具侵略性的价值观,2013/6/21 3:47,0
3,中间几集慢死，换了OP之后进展好多了（重点错【看得18集之后跑去看漫画了，然后觉得好烦好烦，太墨迹了，剧情渣化，无聊，刷兵长的真是欠虐。还有啊，别再为了高端大气上档次就硬扯宗教了，讽刺了这么多年也没个新意,2013/11/4 14:42,0
3,13已阅。每集都有莫名其妙的笑点呵呵呵呵呵呵呵呵。13/06/30 就是话太多，2倍速还嫌慢。E25 21/03/05,2021/3/6 3:18,1
3,剧情太拖沓了吧？编剧是郭敬明么？！15集弃，同志们加油。,2013/5/29 21:06,0
3,越看越没劲！,2014/4/27 17:38,0
3,丁酉27。就。。。比较无脑的热血番吧。据说是现充们也追的热血程度..emmmmm  而且画面相当的“不精致”，感觉工作室是不是人手不足还是忙着喝清酒了。,2017/12/25 14:29,0
3,为什么我觉得很拖沓,2014/4/11 20:49,0
3,弃了 还没有dota从零单排好玩儿 设定奇葩没问题 剧情拖沓是硬伤 op很燃,2013/7/24 10:27,0
3,男主角真特么不！讨！喜！#把我个主角控逼得咆哮算你本事,2014/3/23 1:47,0
3,3.5。最大的悲剧莫过于一场徒劳。,2023/9/30 20:56,0
3,还好养肥才看的不然中间几集磨叽得让人抓狂。男主神烦啊让他办点实事之前先都得死一堆。奇行种的巨人跑起来不要太好笑啊光屁股什么的真是太蠢了=。=泽野弘之的原声气势还是很嗲的。,2013/9/29 21:05,1
3,三爷戏份的戏份越来越少，兵长的萌度也在递减，人类的进击能有看头吗！,2013/9/30 19:42,0
3,我不看动漫的 尤其是这种 可搜我看完了,2013/8/3 0:46,0
3,说说内涵..全剧核心思想不对吧 各种走偏执思想还有本身的设定问题 我真觉得创哥是在从各方面黑人类智商...,2013/10/5 17:15,0
3,巨人竟然木有小鸡鸡，差评！！！,2013/7/11 10:12,0
3,三星半。很燃动人，但还是觉得剧情有点拖沓。,2023/5/22 11:44,0
3,看了一集不想看下一集的極限爆米花動畫……第六集艾伦“死”了给我高兴够呛然后他又复活了 = = 最后貌似什么都没说完有点坑啊,2014/3/18 14:11,1
3,神烦的.,2013/9/30 9:27,0
3,周围好多人都在推荐这部动画片，所以就下下来看看，不过看完也没觉得像他们说的那么好啊，有点像是奥特曼和高达合体的野生版动画片，看起来也不是特别吸引人，也许是自己一直不太喜欢看日本动漫才觉得没意思吧，印象中日本最好看的动画片是《樱桃小丸子》。,2013/11/4 16:32,0
3,那么多心理描写，剧情也太拖沓了，要不是和男盆友一起看我怎么可能坚持到15集！然后到了15集我俩果断弃了！,2013/10/9 17:18,0
3,无语了 整部剧剧情拖拖拉拉  结局好蛋疼 这是要出第二季的节奏 当初搬石头搬了三个星期 现在又要开始凿石头了吗 我要怒打三星！兵长真是帅cry！,2013/10/3 20:53,0
3,还是得靠爆发异能,2013/6/16 16:17,0
3,第一集超棒节奏之后就开始慢慢没意思了。,2013/10/3 11:46,0
3,漫画画的糙的已经不堪入目了。。。动画我就等着三笠变女巨人我就彻底特么不看了。无大作的时代真难熬啊，尤其出了这么多弱B男主角的破漫。。。连大剑这样的都能完爆进击的巨人！！！,2013/7/30 0:33,0
3,脸上的黑线太多了啦！,2014/2/24 8:03,1
3,人类感到如同被囚禁在鸟笼里的屈辱。鸟笼不是人造的？我咋觉得巨人挺可怜的，尤其是安妮，第七八集我都看哭了，后面这都啥啊，一股集体主义的恶臭。何以最爱自由的艾伦也在威权面前卑躬屈膝？一惊一乍叨叨叨，狗血心理分析，过家家的严肃感，我只是来看三笠的，其它都是浮云,2024/12/3 17:23,0
3,第一集可棒可棒了，比漫画棒。顺便问候下麻里奈的嗓子，本来就压低声还搞毁嗓吼法我听得心都在颤。7-8特别棒。,2013/7/1 16:01,0
3,只能是凑合看吧。。。,2013/10/9 10:55,0
3,热血的地方确实有，是我太年轻了么,2014/2/23 16:39,0
3,没看出哪里好,2013/5/28 19:59,2
3,八集弃，看了漫画剧透觉得也就这样,2013/5/31 12:56,1
3,看看影评第一位的那篇是“打一星的什么心态”就知道打3星以上的都是什么心态了,2013/5/8 14:28,1
3,2022年的补评：漫画是好看的（除了结尾），但是当年动画第一季看得我非常不适，所以动画版没有看下去。,2014/8/5 14:32,0
3,莫名地不喜欢荒木哲郎……,2013/9/29 18:49,0
3,我终于知道为什么当初看不下去了，男主真的烦,2017/8/16 12:54,1
3,史实式的悲情感，慢热，对于前面的无大脑猛吼的深井冰没好感，后面渐渐悬疑出来了，总算不枉坚持,2013/9/14 3:16,0
3,哪有评分那么高哦,2013/11/3 18:39,0
3,受不了的分数，我是来托平均分的，超过8.5分不正常,2013/7/13 18:34,0
3,神奇的剧本，给人一会儿节奏巨快一会儿节奏巨慢的赶脚，以为会有戏份的角儿瞬间秒死了，于是另一批怪人出现，作者貌似想把热血动画转化成一部意蕴深刻的反思型动画了。看一半弃了。。。,2017/1/16 13:56,1
3,只看了前面几集,2014/3/6 9:54,0
3,"看了前七集 后面18集看的解说
优点是剧情紧凑、场面宏大、剧本很多反转点 看着并不会走神和累
缺点就在于我是在受不了日漫里中二般的热血，我总觉得好好说话不可以吗，整得那么亢奋我真的会尬住……",2022/12/11 20:12,0
3,打斗值得五星，弥补人类缺陷的机动装置永远值得激动。但节奏好怪快快慢慢不断交叉，为了后续铺垫埋了很多不讲清楚的内容看下来很苦恼，有一种被遮盖一只眼睛看番的感觉，不爱这种感觉。,2024/7/29 14:21,0
3,天哪。。。。日本动画怎么能做成这种水准了。。。。。。。光有好剧情也白瞎了,2014/2/17 11:36,0
3,进展太慢，老回忆你妹啊……麻麻被吃了千八百次了……,2013/10/18 16:15,1
3,巨人食经,2013/6/29 21:02,0
3,OP好听，对这种中二病主角越来越讨厌了。,2013/11/14 12:17,0
3,很久没有这样燃的新番了,2014/2/5 13:36,0
3,等的急死人，画风还不错,2014/1/24 11:14,0
3,超出我的忍受范围。。。,2013/12/3 16:30,0
3,这个番好像已经成为民工啦？,2013/9/30 12:36,0
3,经费不该省的时候省得有点过分了。。。。太拖沓了，还有那些无聊的人性和人性闪光时刻。。。。,2021/1/11 13:45,4
3,设定不错 但也没有那么神了,2013/7/5 11:32,0
3,我只喜欢看动作片段，超爽超帅，每集都期待有巨人出现···很少喜欢动漫女主，不过三笠真的不错，反而是男主挺讨厌，为什么总在吼？嗓子不疼吗？还有人物名字什么的也太难记了吧！要雪星就雪星到底呀！为毛没有最直接的特写镜头！我还以为我看的是和谐版呢·····,2020/7/2 6:05,1
3,墮落奔向自由？饕餮之悲歌。其實那怪物般的巨人即從人類中來。就以這25集的思維來看，直覺作者會收穫不幸。製作三星，故事本身一星。原配音各角色太多激情，少了粵語配音都沒法看下去。ps.城牆教是厚黑角度的笑點。,2014/6/12 12:46,1
3,退步。。,2013/10/1 18:23,0
3,越讲越悬了，战斗力进阶爆表定理，和玄幻小说一个模子，其实是我初中日记里那些玩意。那一天，人类终于回想起了，曾经一度被他们支配的恐怖，还有被囚禁于鸟笼中的那份屈辱。,2015/1/19 1:44,1
3,我只能说，漫画画的有多烂，就只能靠动画来弥补，真的画的太难看了,2013/9/11 16:49,0
3,独特的世界观，严谨的逻辑，无萌无腐，蛮好的动画片啊。但在男主这种情商智商俱低的情况下，要努力看下去真的是很替他捉急啊,2013/10/20 12:32,0
3,一开始觉得故事是新颖的，可是中期剧情开始不行了，使得弃番。腐女们热爱的利艾也没萌上，女汉子三爷也没感觉。只能记住里面4个人的名字，其他都不知道叫毛,2013/10/6 22:39,0
3,"13年14年燃不起被这丑人设丑了，两次试图看还是弃。
第三次，在20年夏天终于从第7集艾伦由人类巨人化开燃决定补番猛刷，还是肌肉型热血巨人。因为家有小弟疯狂推荐",2014/1/4 14:58,0
3,基本上处于很好看与很不好看之间，铁了心做13集嫌太赶，25集又显富余太多没啥紧迫感，不过三间雅文和泽野弘之之间的平衡感真棒啊ww期待绑定(<ゝω·),2013/10/8 11:38,0
3,后来弃了，居然一直停留在“在看”状态，忘了标。题材不错，可是虎头蛇尾的剧情毁全部。总共还没拍几集就这样了，编剧不行啊。,2016/9/24 2:39,1
3,很多男生一喜欢看，但真不是我喜欢的动漫类型。,2013/11/9 16:04,0
3,原谅我的苛刻.....故事性很一般，画面又血腥暴力，不如尸鬼给我的感受深刻,2014/8/29 0:30,1
3,后面看不动了，老了么办法。,2014/8/10 23:15,0
3,什么是悲剧，就是猫吃鱼，狗吃肉，奥特曼打小怪兽，最后发现大伙都是一家人，本是同根生，相煎何太急。PS：泽野弘之赛高！！！,2013/9/30 11:04,1
3,一如既往（日漫）的罗里吧嗦。,2013/8/17 19:40,0
3,剧情进展略拖沓。第二季追不追难说。,2013/10/21 18:00,0
