rating,comment,time,votes
4,在《大圣归来》和《大鱼海棠》时没看到的国漫希望终于在这一部看到了！该有的视觉效果、想象力、主题和力度都有了。脱离了《哪吒闹海》的悲情与重生，魔童哪吒对抗偏见与命运的改编少了几分艺术性，但也有商业化的动人之处。好莱坞式的搞怪和浓重的家庭主题必将此片推向暑期档爆款。结尾三个彩蛋，是时候祭出《封神榜》这个大IP了。,2019/7/13 18:27,10
4,3.5，整体挺喜欢的，是抛开情怀之类，近年最喜欢的一部国产动画。因为剧情很完整，改编也很合理，是真的花功夫了。但是，说一下不喜欢的2点吧：1、其实正片没有预告骗那么成人向，但是里面那些笑点啥的，都旧，是1998年那会的网络语境的笑点；2、不太喜欢拿口吃和汉子女声作梗。,2019/7/12 22:13,10
5,想让全世界都来看我们的哪吒！！！,2019/7/17 21:15,32
4,三星半。申公豹也是在抗命啊，最大的boss难道不是元始天尊嘛。他和天庭埋下全剧的所有矛盾，然后几乎缺席了整个剧，剩下的都是群众内斗。,2019/7/19 23:43,22
4,比大圣好出一个白蛇,2019/7/23 19:55,3
4,毕竟我们已经不是反抗皆祸害父母的小孩 而是要驯化熊孩纸的父母了（还好我不是）所以立场180大转，但赚的还是同一批人的钱…技术真的厉害 动态简直要赶上蜘蛛侠了。李靖夫妇差不多就是郭靖夫妇…,2019/7/28 20:32,3
4,出人意料的精彩，年度超级黑马即将诞生。把哪吒塑造成一个孙悟空般的反英雄角色，颠覆成功。文本层面上，仍未摆脱国漫故事薄弱的老毛病，为了赶进度编排了最典型的三幕结构，造成深度有限，“我命由我不由天”这种主题幼稚且口号化；几处台词极其违和，为了制造笑点反而使故事脱节。从技术上讲，它也绝不是国产动画的“总统山”，依然是场景精美而人物粗糙。但整体看它仍然是出色的，因为优势太明显，其一是惊艳的动作设计，初入山河社稷图可以入选年度最佳段落，这个场景的分镜是主创想象力一次水银泻地般的展示，片尾则以缩略（宏观）的形式再次惊艳了一把，游戏感十足，中段水夜叉的追逐打斗戏也下了功夫；其二是将近半小时的第三幕，始终保持快节奏的连续打斗牢牢把控住观众情绪，哪吒两次变身是截然不同的气氛渲染，一惊一喜，全部燃爆。,2019/7/17 22:29,15
5,【B-】有瑕疵但整体还是惊喜更多,2019/7/17 21:50,14
4,很好看呀，跟童年回忆中的哪吒有不一样的内涵。但我还是更喜欢剔骨还父、削肉还母的那个哪吒啊。,2019/9/5 23:28,9
4,剧本、人设都算丰满，制作也考究，是一部合格且具有观赏性的国产动画。但不要轻易简单粗暴去吆喝一句：“国产动画片从此崛起了”。2015年《大圣归来》的时候，他们也是这样声嘶力竭的。偶尔一次闪光，不代表崛起了，所谓的崛起，应当不止单纯在质上，还要看量。不服？那就从纬度和经度上回顾一下美日的动画吧。BTW，魔化后的哪吒形象，请不要抄袭赛亚人，太明显想蹭心理暗示了。,2019/7/28 14:19,1
4,在陈塘关口见敖丙，气坏了哪吒小将军。某自幼魔丸入了身，偶遇着太乙老真人。某中了敖丙的离间计，俺变化了申公豹捅他后庭。弃暗投明来修心，食娘的哺喂当报爷的恩。孝当报过仁心尽，再与那真人把话云，一不用战鼓咚咚打， 二不用副将随后跟， 只要火尖一杆枪， 红绫金圈风火轮。 十分钟内得了胜， 你把莲花塑了某的身； 十分钟内不得胜， 陈塘百姓化埃尘。 来来来，带过爷的风火轮， （摇板） 我要把拉莱耶一扫平！,2019/7/14 23:59,5
4,出乎意料的不错，是一种工业水平上的优秀：特效在我看过的3d动画里算最好的那档，那个水的视效跟迪斯尼比也不怵；剧情流畅先插科打诨后燃，笑点套路但我周围观众都很买账；演出节奏一气呵成，尤其是最后的4人大战，看起来非常过瘾；最后煽情+升华那段有点像大圣&流浪地球，就是主旨很简单但配上宏大音乐就非常通俗容易共情那种燃。美中不足就是前半段轻松搞笑触动不了我，让我一开始以为这是一个类似沙僧日记的恶搞片。但看到后半段哪吒学成后才发现，它其实更像悟空传，哪吒故事的整个灵魂或者说经典元素是被提炼后融入新故事中的，甚至改了以后原作中逻辑不通的地方都能解释得通了。比如李靖为何如此严厉古板？哪吒和敖丙究竟多大仇要打成那样？而核心的哪吒的冤屈和反叛是有的。哪吒和敖丙也太偷摸大鸡了！佐鸣+小鱼儿与花无缺。暗黑龙宫也有趣,2019/7/12 23:45,10
4,没看出哪里反父权，只感觉李靖真是个好爹，至少比大多数爹强。敖丙他爹给龙鳞的时候我真是艹了，你可是我们家族唯一的希望啊！你不能有自己的感情！你要助全族成功！……啊啊啊狠狠共情了，被希望推动着长大而不是被爱包围长大的人有多痛苦啊谁能明白！！！,2022/8/27 12:13,5
4,细节的完成度已经达到了好莱坞动画的标准，这个细节不仅仅指画面、特效，也包括剧情、笑料、包袱，与国内一众手工作坊生产方式下制作的电影相比，确实显得脱颖而出，也导致整部电影看着不像一部中国电影。当然，作为一种工业化流水线生产出来的娱乐产品，本来过分追求所谓的中国味，也很没必要，所以非要拿这部电影与1979年的《哪吒闹海》相比较也没什么必要，根本上就是两种不同的东西。这个是产品，那个是作品。而且从意识形态角度讲，这个其实更符合西方主流价值观，讲个人奋斗改变命运，太美国了，《哪吒闹海》倒是造反有理的革命价值观。,2020/3/19 15:10,4
4,意外吹爆啊，赶紧出口赚一票，从东亚到南亚到欧美，让世界好好看看懂懂中国的亲情文化！我们的动画产品也不差！,2019/7/26 22:24,1
5,4.3星。有些人设非常Tim Burton，剧本没完成（也许故事会在《姜子牙》里继续），搞笑部分有时太尬，以及哪吒宝宝小时候太丧太痞接受不能。然鹅，挣脱了乾坤圈的成魔哪吒实在是过于狂气冲天、霸气爆表，帅到我头脑空白……动画史上最颠覆的哪吒值得这五颗星。,2019/7/13 17:19,9
4,找准了我国观众心头的那份反叛因子，自然是一点就能星火燎原。于我来说比较惊艳的是对经典的现代重构满溢着民族自豪之感，打斗部分的剪辑与掌镜也真的让人爽到，又有普适的亲情友情在其中穿针引线。当然剧作还有不够圆润之处，不过作为封神宇宙的开山之作，足矣了。让这把火烧的更旺吧！,2019/7/28 20:39,2
5,我心中的国产动画影片第一名,2022/8/18 17:26,15
5,甩迪斯尼好几条街！技术已经达到顶级水平！故事改编得有趣有人情味！可惜“哪吒”好丑！为中国国产动画的进步感到骄傲！致敬每一个为中国动画努力拼搏的人！,2019/7/29 16:05,5
4,笑点低廉，技术扎实，逻辑走心有支点，人物设定有维度不极端，剧情脉络行止有度，审美偏近商业。我给7+。神仙的自我修养那里明显有周星驰的痕迹，踢毽子打墙却无法与如来神掌解毒相提并论，而这还只是导演审美力走偏的百分之一例。哪吒的塑造倾投中二杀马特方向，敖丙的塑造则过于薄弱且偶像化，配合全片廉价而网络化的笑点，若不意在圈钱，就只能理解为导演太想成功的执念——若追求如此，最快捷就是堆资源造星。可偏偏它还想成为什么“崛起希望”。假若干年，底裤不保，莫怪年轻人。,2019/7/28 21:51,2
5,基于哪吒传说的颠覆式改编，《哪吒之魔童降世》充沛的剧情构思下，电影有着打动人心的羁绊，有着催人泪目的亲情，有着关乎自我认知的觉醒，更还有着哪吒“我命由我不由天”热血的反叛意识，这部足以让人为之瞠目的国产动画，令人见证的不再仅是国漫的崛起，而是国漫拥有了真正能与好莱坞动画佳作相媲美的灵魂。,2019/7/22 19:08,7
4,四星鼓励分。红蓝又出一cp。技术层面已经没有什么大问题了，整体牺牲哪吒故事深度换观感整体还算成功，但是还是太多细节需要打磨。,2019/7/21 19:39,3
5,“三年短是短了点儿，不过我也玩儿得挺开心的”,2025/2/4 22:01,11
4,一开始以为是中国《好兆头》，结果到后面发现最像《流浪地球》：）,2019/7/26 21:23,4
4,个人觉得搞笑桥段比较尬……但是总体比想象中好一些。上海美影版固然经典，但其实也不用纠结这一版改编里人物关系的改变，要讲的东西不一样。彩条屋封神宇宙值得期待！,2019/7/21 21:00,11
5,拍的太棒了！人设的重塑，内核的升华，精致的视效和故事上老少皆宜的通俗，不端着但也不low，恰到好处的拿捏，真正的国漫之光！,2019/7/21 19:00,9
4,今天的主題是“我命由我不由天”，那妖怪憑什麽就要被鎮壓？爲什麽魔丸就要引天雷擊打？這就是問題，只是拯救了村民獲得世界的認可，而且幸運地活了下來，這樣就高興了嗎？最多是妥協而已。劍指天庭，把高位者趕下來才真的熱血，真正的“我命由我不由天。”,2023/4/29 17:44,4
5,奔着国产神话动画去，结果收货了爱情。,2019/8/17 15:36,2
4,如果没有那么多“无聊”的笑料就好了，当然这个见仁见智了…,2019/7/14 17:30,5
4,三星半吧，不如大圣，中二热血有，但前面刻意低幼搞怪太重复了，导致节奏不好。龙族的改编是个亮点，敖丙的线本来更完整，却为了主线强行黑化了。灵珠魔丸强行设定，把哪吒反抗伦理的人设改成了哪吒的反抗命运，但不太立得住，所以最后基本靠喊，强行煽情了,2019/7/27 14:35,5
5,好 真好 特别好 说比大圣归来好吧，我不认，我有悟空滤镜。 但是真的很棒，笑点很密，哭点忍不住的那种，看完小姐姐都在问妆花了没。 设计的超有点，不能剧透，但是每一个人物都出彩有特点。 中间一度好生气 超级心疼哪吒 能力没有好坏之分，是看你如何使用它。 父母之爱子，真的很动人。 太极生两仪，很中国。 彩蛋有三个，但是最后一个是姜子牙广告。 讲真的，中国古代神话故事这个max级别的IP，生生代代也看不够。,2019/7/20 19:11,11
4,不错，充满解构气息（除了部分地方有点尬…,2019/7/27 21:04,1
5,想象力和细节都要超过皮克斯，赞的。（PS，也很怀念老版哪吒的一剑自刎，悲情。）,2019/9/5 14:44,3
5,很好看耶。重构了传说，意料之外的情节，打斗场面很燃，太乙师徒有笑点，父子情有泪点，与敖丙的友情有热血点。,2019/7/24 10:06,9
5,呜呜我爱哪吒！！他太可爱了他和敖丙太配了吧！！,2019/7/22 8:18,5
5,看完觉得很骄傲！！哈哈,2019/7/26 17:49,4
4,一定要让恶的学善，善的学恶，这才是冰与火之歌。我相信画者一定脑中有原型，否则不会出现一看到哪吒的牙我的眼前就会浮起王宝强的笑。还有敖丙的巨型棒棒糖很招人喜欢。,2019/8/5 17:51,2
4,小时候看的第一部动画是1979年的《哪吒闹海》那是记忆力最棒的动画电影。 2019年的《哪吒》老故事改编，完成度很高。趣味性也足够，屎尿屁也不觉得恶趣味。前十五分钟就带动泪点，110分钟至少三个泪点。 动画妆感也可以接受，3G设计也见用心，定格画面过少，为了追求高密度快节奏，让炫丽的场景浪费了。 内核虽然台词化，但通俗易懂适合儿童观赏。音乐性的控制其实差了一口气。,2019/7/27 15:23,3
4,故事改得好，创作无定法，天地大战中间也可以穿到画里插科打诨一番，看多了套路肯定觉得有点断节奏，但这个时代，标新立异就已不易，眼光别那么教条。人物可可爱爱的，招人喜欢，来自村民的压力有点平，做出点反复可能会更虐。,2019/7/29 20:30,6
4,听到某神仙的“川普”突然想到了一个梗，就是真正的四川人是分不清“娜扎”和“哪吒”的，哈哈哈！亲情线很动人，但是金吒和木吒去哪儿啦？有颠覆有创新，挺精致的。,2019/7/14 17:46,9
4,老家新开的电影院，三十块钱包3D，就是那种邪典动画，巫毒娃娃的感觉，最后非常政治正确，人定胜天，命运要靠自我奋斗，三观太正！,2019/8/1 22:57,4
4,Disney风格与迎合95后趣味嫌多,2019/9/27 17:50,1
4,所有的偏見都伴隨著歧視，所有的歧視都成為了霸凌的藉口。舊瓶裝新酒，借著哪吒說霸凌，只可惜現實里沒有那麼多哪吒能打臉那些霸凌者，更多的哪吒們只能一身傷痕，甚至遭受著PTSD的折磨，只能祝福他們成為什麼樣的人真的能由他們自己決定。,2019/7/17 21:35,12
5,当年看《大圣归来》的感觉又复苏了，现在中国动漫终于不用羡慕梦工厂皮克斯了,2019/7/25 16:28,7
5,厉害,2019/7/27 19:24,7
5,可以说是年度国产电影最佳了，开始没看的时候看到网友评分这么高还在想是不是虚高。现在看完不是的，真的很喜欢这个改编，除了那些村民，听风就是风听风雨就是雨，每个人的人物设定都立得住。 龙族太惨了，敖丙太帅了，哪吒变身之后也是帅，没变身的时候是个腹黑娃娃。 当年还在上大学的时候，就看过导演的《打个大西瓜》，一个不是科班出身就因为爱好做了短片，到今年当了导演做了长篇，说实话，真的很佩服他。 应该还是有下一集的吧，期待吧！,2019/7/21 18:34,9
5,太宰治说：生而为人，对不起。导演饺子：生而为魔，斗到底！哪吒背负着妖怪的骂名，心中尽是怒火，却因为父亲的一个决定，甘愿承受九天雷。敖丙肩负着家族的兴亡，眼中满是无奈，却因为朋友的一句承诺，情愿献出万龙甲。两个拼命渴望认同的异类，做出了不需要认同的选择。在那一瞬间，两个人同时抛开了固有的成见和他者迷思，实现了自我意识的确立：我的每个决定，源于自我意志，而非领袖意见或者现实考量。命从何来？其实命从成见中来。道家主张道法自然，元始天尊如此修为，心中尚有善恶之分，仙魔之别，何况人呢。认同了这份成见，就等同于认可了强权替天行道，也就认了命。面子仙风道骨，里子强横傲慢，这安排好的命，不认也罢。人物塑造生动，视觉特效精美，以现实主义开头，以浪漫主义收尾。饺子打破了国人对国产动画的成见，他不认命，他做到了。,2019/10/14 19:05,8
4,【B－】惊讶的是不只像预料中呈现的异于常态的“哪吒”，电影对几乎电影中的每个角色都进行了不同于最初神话的二次创造，而更厉害的是创造的相当成功，每个人物都非常鲜明立体，矛盾冲突以及共通点都完全立得住，基本是完全建立了自己的“封神”世界，如此以后更有无限的创作空间。不过整体是失望和惊喜并存的，娱乐性、故事技术都达到了高峰，加入的喜剧元素多数成为了亮点，虽然主题仍旧老套“我命由我不由天”，但贯彻的最彻底，看起来如此中二的一句话却真正的拍出了燃；值得称赞的是其极高的执行力，动作场面眼前一亮，后段一场对画笔的争夺戏的长镜头调度堪称出色。最大的缺憾应该是学漫威过头，很多笑点的加入不分时宜，以及不知如何收尾便草草结束、却又偏在片尾拉出好几个彩蛋。,2019/7/20 22:04,6
4,近几年最好的国产动画，人物的夸张的表情、动作，整个故事的结构、节奏，包括家庭关系和温情主题，借鉴了福克斯和迪士尼很多，但不可否认视觉元素的中国化还是很不错的。有给差评的说不如老版老版，玷污经典，这是什么鬼话，老板的弑父情节和暗黑气质也是再创造，如果再 拍一遍又要被说抄袭，何况这片一开始就是要做个合家欢电影，什么叫什么好的商业片，达到了自己的商业诉求，就是好的。,2019/10/22 12:28,3
5,闭关修炼的部分再加点戏就更完美了。也希望龙族戏份多一点。还有山河社稷图应该出周边啊！！！,2019/10/24 19:45,2
5,我算是看明白了，国外的动画，就算没东西，也得给你过度解读出来2000字，9.0+的评分不喜欢也得5星，对于国内就是先把有色眼镜带上，钉到耻辱柱上，一顿挑毛病。仿佛说，你要一口吃不成胖子，就不要选择进步。,2019/7/27 5:57,9
4,哪吒恶童的出身，和Hellboy的套路太像了吧。封神榜那么多妖魔鬼怪，你要拍一个三界版复联么？看预告片下作是姜子牙，倒是更期待杨戬呢。前提是这个系列继续下去。,2019/8/1 14:48,4
5,挺震撼的，大圣归来已经不错了，这个却好像可以拿奖了,2019/7/28 22:59,5
4,三星半，我觉得论质量跟《大圣归来》或是《白蛇缘起》不是一个级别的，但是这种极具反抗精神、充满想象力的作品在国内实在是很难得。有太多地方致敬了周星驰（喜剧部分几乎都是），有些人可能会觉得是彩蛋，有些人就会认为是在模仿。,2019/7/14 19:24,1
4,哇，场面真的是超出预期得好！但有些低级趣味实在太影响观感了...,2019/9/1 21:55,7
4,改编倒是无所谓。艺术的东西，本就百无禁忌。只借壳借名、甚至曲解，来表达自己理念，无所不可。想象力，有（看到后世教育可有光）；技术，有；审美，有。幽默感，很差，市侩、网络、流行语，如口啃爆米花之虚屁浮流、毫无根基。哲学观，有一点进步，经济发展所带。努力挣脱桎梏，力气用在“求新”上，未见“寻古”之道。可看到与中国式父母的和解，虽暂且只是自造之愿景、非真实历经情感，但至少这愿景呈现了做儿女（做人）之所望。女性形象有进步。改成独生子女可还行。:) 最后，观望导演搅不搅基吧。哈哈。,2020/2/11 2:18,2
4,龙集体劈逆鳞那一段的悲壮使命感，印象最深。还有就是国产动画的主要角色配音终于终于不出戏了。最终高潮也分为好几波，比大圣归来的混作一团的剧情画面强太多。,2019/8/9 12:57,4
4,太乙真人差不多是被哪吒绝育了。,2019/9/7 21:40,7
5,哪吒既然是“三公子”，那金吒和木吒呢？,2019/7/27 0:00,7
5,实名diss首页热评第一的熊猫大叔，单从几张海报就说是烂片无疑，肤浅的见识，打出的字都有语病，什么基本完全？？？你又有什么资格代表成人说不能接受这样的设定，撞壁要有度，你随便几句话就可以在电影上映前否定制作人员的心血？？,2019/7/27 0:45,20
5,其实说完全没有瑕疵那是假的，但是和同档期的狮子王比这个可以吹爆了。 果断五星。,2019/7/26 22:26,5
5,瑕不掩瑜，老少通吃，暗搓搓的核心思想还是很毒的。,2019/7/19 21:15,4
4,故事学的周星驰，技术学的皮克斯，学的还不错。但最有意思是故事内核，哪吒作为寻求个人自由者之象征，在旧版里主要抗争对象是权势和父母之命，在新版里则要抗争妖魔化他的群众和自我认同混乱。虽然去了郑智化，但更贴和当下自由主义者的实际也更深入了。,2019/7/28 22:36,2
4,陈塘村民是真的命苦,2019/8/4 23:08,2
4,丑哪吒越看越cute，太乙真人形象又颠覆又饱满，连申公豹都很有角色特点，打戏画面流畅度真的很不错，如果结尾处理好点，就完美了。,2019/7/19 21:19,8
5,果然爱是最终的解咒,2019/8/3 21:54,6
5,山河社稷图当空间斩用 不愧是太乙救苦天尊 那个乾坤圈是金箍客串的吧 拿武力/颜值换智商的debuff道具 藕饼 真香,2019/8/3 22:15,5
4,好用的套路梗+政治正确+普世价值+心灵鸡汤，商业目的明确而且手法精准，人物基本都是空壳，不是我的菜但是国产动画做成这样还是应该鼓励。 还是喜欢那个白衣胜雪傲气冲天一人做事一人当的哪咤。,2019/7/27 2:01,3
5,电影的主题很丰富，有关于家庭亲情，有关于个人的责任，有关于命运的，最让人感动的是这些人的选择，哪吒不甘于命运，选择了彻底的反抗，最后又因为亲情的羁绊回归了正义，这证明没有天生的魔丸只有选择的对错，三太子背负龙族命运的最后选择了友谊，这是命运对灵珠嘲讽后的拨乱反正，这部片子每个人都很立体，很多点让我感动，是一部极其成功的电影，为国产动画鼓掌，并脱帽致敬,2019/7/29 6:18,2
5,首先我不认可上了一部国漫就说它代表了什么现代的国漫水准啥啥的，那我们需要的不是一个哪吒，是十个哪吒加十个大圣才可能，其次这是一部挺不错的片子，你打击它，我也不会去看银河补习班。最后，它的缺点的确很明显，不仅仅是歧视和屎尿屁，还有是里面的转折和一部分世界观，比如哪吒对白龙说的，要做自己，不要在意别人，可他自己不也是如此么？最后他的爆发到底是为了救父母还是为了救百姓？所以从这两个点上来说，这个片子还有缺憾，但不影响它依旧是一部好的，且足够商业的作品。因为同期的作品都太烂，所以我要多给一星。就这么任性了。,2019/7/21 20:47,6
4,整个故事讲了两个天赋异禀身怀绝技的孩子在面对来自普通人的压力时如何寻找自我价值、实现自我救赎的故事。从海报看应该是双男主双线并行的戏份，但哪吒线挺丰满，敖丙线太单薄了。从彩蛋来看，续作应该会补全敖丙线的故事，脐带～,2019/7/28 20:45,3
5,从之前的“龙之谷”和“魁拔3”的后期画面崩盘，到近两年“大圣归来”和“风语咒“的剧情单薄，再到这部哪吒，国产动画可以看到有很大的成长。这次不光是画面精致（当然可以更好），剧情和笑点也都非常的成熟，算是个非常完整的作品了。这次没有爱国加分，满满的实力五星。,2019/10/21 8:10,1
4,两朵莲花现化身，灵珠二世出凡尘。 手提紫焰蛇矛宝；脚踏金霞风火轮。 豹皮囊内安天下；红锦绫中福世民。 历代圣人为第一，史官遗笔万年新。 （饺子导演超级帅，主持人问他微博号，说想把他捧成大V。导演腼腆一笑，说我还是潜心创作吧）,2019/7/25 23:15,3
5,故事明显想要表达的不认命主题感觉稍有些生硬，但趣味性、创意性和动画水准已经相当之高。再接再厉！,2019/7/28 0:51,4
4,刚开始，那口川普一出来，我还以为是看得四川话特供版。也太好笑了把，导演真是个人才。哪吒的黑眼圈好可爱。他人笑我太肤浅，我笑他人看不穿。,2019/7/14 18:12,7
5,神童的命不由天，老百姓的命，听神童的,2019/8/1 13:56,1
4,可能会是暑期档后劲很足的一部电影，制作和剧作上的完成度都很高，而且把这个古早的故事无论在表现形式上还是内核上都改得比较现代，喜欢江山社稷图和投影猪！喜剧元素运用的足够通俗讨喜，太乙真人的四川话真可爱亲切。哪吒和敖丙的cp不就是冰与火之歌吗，亲情、友情、热血、个人成长、我命由我不由天的情感点都是颇能引起共情的卖点。主角的人设也比较微妙，看起来是反叛魔童，其实也是在渴望被主流接纳，打的是偏见与孤独这些情感点。如果结尾的哪吒宣言能收一些就好了。就不吼什么国漫崛起的大喇叭了，总之个人觉得比《大圣归来》好看，娱乐性强，门槛不高，市场接受度会不错。,2019/7/18 22:27,4
5,没有请痛仰唱主题曲真的失策。,2019/7/27 12:23,2
4,《哪吒之魔童转世》已验，推荐。除了技术上的成熟，最重要的一点是价值观的提升。原先哪吒在人们印象中的嫉恶如仇，略显单薄，现在的人物设置和反转，立的住，而且更加耐人寻味。这比技术上的提升更让观众看好中国的动画片的发展。用朋友的话就是:“高级”。,2019/7/27 17:36,2
4,不幸被纪录片放映员猪飞骑给圈粉，大决战简直“冰与火之歌”，特别喜欢画卷内四人抢笔那一段。不管能否接受这样的画风巨变（哪吒是丑了点，部分情节恶俗），也必须承认，它跟上了世界电影工业潮流，也让人看到中国动画技术的潜力。,2019/8/3 17:14,5
5,饺子应该非常热爱踢毽子。,2019/7/28 18:16,7
4,可以给国漫贡献两张票，看完不肉疼的程度。,2019/8/9 14:31,1
5,画面已经顶尖了，故事节奏还有提升空间。以及小二代目第一次去电影院。,2019/8/24 19:46,5
4,需要推翻对哪吒的固有印象，会发现你像在参加一场摇滚音乐节。,2019/7/30 0:45,1
